CURRENT COMPANY,JOB TITLE,FIRST NAME,LAST NAME,EMAIL,UNIVERSITY
Douglas LLC,GIS Technical Architect,Niel,Lauthian,nlauthian6o@reverbnation.com,Suzuka University of Medical Science
Braun-Reichert,Marketing Assistant,Elvina,Kundert,ekundert6p@unc.edu,Saga University
Kiehn Inc,Electrical Engineer,Bidget,Bourtoumieux,bbourtoumieux6q@webnode.com,Universidad Mexicana
"Sauer, Prohaska and Ryan",Mechanical Systems Engineer,Cortie,Koppke,ckoppke6r@virginia.edu,Goshen College
Kertzmann-Aufderhar,Actuary,Moina,Hingeley,mhingeley6s@flavors.me,Universidad Intercontinental
Beatty Group,Systems Administrator III,Christoper,Kreber,ckreber6t@skype.com,Princess Sumaya University for Technology
Miller and Sons,Research Associate,Corbie,Collin,ccollin6u@bbb.org,Shenyang University
McLaughlin Group,Health Coach IV,Inger,Garvagh,igarvagh6v@linkedin.com,Guangdong Polytechnic Normal University
Christiansen-Casper,Statistician I,Egbert,Hobbing,ehobbing6w@creativecommons.org,Vietnam National University of Agriculture
Goodwin and Sons,Information Systems Manager,Llewellyn,Mees,lmees6x@jimdo.com,Université Hassan Ier - Settat
Schroeder Group,Software Engineer II,Silas,Arndell,sarndell6y@dailymail.co.uk,Medizinische Universität Graz
"Erdman, Harvey and Von",VP Accounting,Domenico,Tutsell,dtutsell6z@about.com,Xi'an University of Technology
"Bailey, Koch and Bechtelar",Sales Associate,Ritchie,Watkiss,,University of the Ryukyus
"Kuphal, Boyer and O'Kon",Help Desk Operator,Pieter,Sedgeman,psedgeman71@myspace.com,Corporación Universitaria Tecnológica de Bolivar
Oberbrunner Group,Physical Therapy Assistant,Bruis,Detoile,bdetoile72@ehow.com,"International Banking Institute, St. Petersburg"
Lebsack-Tillman,Nurse Practicioner,Waldon,Benstead,,International College
"Gleichner, O'Keefe and Kessler",Physical Therapy Assistant,Uriah,Vankov,uvankov74@ameblo.jp,Fushun Petroleum University
Treutel-Hilpert,Human Resources Assistant II,Abagael,Gerckens,agerckens75@elegantthemes.com,Shimonoseki City University
"Cruickshank, Yost and Leffler",Human Resources Assistant II,Leshia,Rayment,lrayment76@t-online.de,Toin University of Yokohama
Goldner and Sons,Programmer III,Caitrin,Silverwood,csilverwood77@google.nl,Zhezkazgan Baikonurov University
"Muller, Moen and Hackett",Business Systems Development Analyst,Bran,Colliss,bcolliss78@aboutads.info,University of Macedonia
Brown LLC,Data Coordiator,Selestina,Gouley,sgouley79@rambler.ru,Regis University
Bogisich and Sons,Recruiter,Chanda,Every,,Ripon College
"Dare, Wunsch and West",Senior Quality Engineer,Zondra,Padgett,zpadgett7b@columbia.edu,Universidad Nacional de Salta
Harber-Waelchi,Nurse Practicioner,Baryram,Weatherall,,Stenden University
"Harvey, Ruecker and Stokes",Compensation Analyst,Koralle,Olivetti,kolivetti7d@elpais.com,Sokoto State University 
Gusikowski-Wolff,Assistant Media Planner,Boyce,Dametti,bdametti7e@census.gov,Polytechnic Ibadan
Krajcik and Sons,Product Engineer,Parke,Pring,ppring7f@ucla.edu,Gulu University
Bernhard Inc,Information Systems Manager,Sammy,Staker,sstaker7g@simplemachines.org,Albany Law School
"Bogisich, Hammes and Gottlieb",Operator,Vachel,Hasley,vhasley7h@epa.gov,Universidad de Piura
Heaney-Kris,Programmer II,Olympe,Steer,osteer7i@boston.com,Nagoya Women's University
Brakus Inc,Safety Technician I,Benjamin,Van de Vlies,bvandevlies7j@weebly.com,Rakuno Gakuen University
Trantow LLC,Help Desk Technician,Catarina,Punt,cpunt7k@tamu.edu,"University of Agricultural Sciences, Bangalore"
Ritchie-Parker,Food Chemist,Zackariah,Wych,zwych7l@nba.com,Memphis College of Art
"Dare, Wisozk and Koepp",Geological Engineer,Krishna,Bardwell,kbardwell7m@free.fr,Universidad Central del Ecuador
Beier Group,Assistant Manager,Regan,Halso,rhalso7n@home.pl,Jackson State University
Robel LLC,Pharmacist,Warren,Brewood,wbrewood7o@oaic.gov.au,Nanjing University of Economics
"Abernathy, Doyle and Wyman",Social Worker,Mirabella,Vagg,mvagg7p@exblog.jp,Université Claude Bernard (Lyon I)
Schulist-Oberbrunner,Assistant Manager,Joletta,McCullough,jmccullough7q@dell.com,University of Kota
Torp-Wiza,VP Quality Control,Babbie,Suttle,bsuttle7r@4shared.com,Universiteit Gent
Stanton Inc,Clinical Specialist,Hunter,Keam,hkeam7s@webs.com,Fukuoka International University
"Rath, Bednar and Schumm",Web Designer II,Catharina,Grice,cgrice7t@google.co.uk,Universiti Malaya
Hegmann-Balistreri,VP Marketing,Hilton,Lyddy,hlyddy7u@etsy.com,Ecole Nationale Vétérinaire de Nantes
D'Amore Group,VP Accounting,Idell,Tye,itye7v@tumblr.com,Obihiro University of Agriculture and Veterinary Medicine
Zieme Group,Environmental Specialist,Johannah,Cluney,jcluney7w@artisteer.com,"California State University, Fullerton"
Dach-Kunde,Engineer II,Hedi,Reith,hreith7x@delicious.com,Technische Universität Hamburg-Harburg
Morar-Ankunding,Mechanical Systems Engineer,Pierson,Aslum,paslum7y@europa.eu,University of Palermo
"Champlin, Kihn and Lehner",Senior Cost Accountant,Archibaldo,Devany,adevany7z@businesswire.com,Institute of Finance
Littel LLC,Civil Engineer,Chance,Barnicott,cbarnicott80@oracle.com,York University
Keeling-Bartoletti,Biostatistician I,Mirabelle,Wolfendale,mwolfendale81@behance.net,The Global College Lahore
"Anderson, Schowalter and Hermann",Account Representative II,Luca,Arran,larran82@delicious.com,Universidad Nacional Pedro Ruíz Gallo
Nicolas LLC,Safety Technician III,Stevy,Bratcher,sbratcher83@scribd.com,Centro Universitario Villanueva
Morissette-Hermiston,Speech Pathologist,Norrie,MacGilrewy,nmacgilrewy84@oracle.com,University of Dallas
Okuneva-Dibbert,Project Manager,Morey,Yokel,myokel85@guardian.co.uk,Valley View University
"Kilback, Moen and DuBuque",Librarian,Ben,Brudenell,bbrudenell86@acquirethisname.com,Himachal Pradesh University
Runte-Kovacek,Automation Specialist II,Jerrilee,Gerrie,jgerrie87@noaa.gov,Ohu University
Bailey and Sons,Analog Circuit Design manager,Ginger,Caines,gcaines88@odnoklassniki.ru,Newman University
"Medhurst, Lowe and Harvey",Media Manager IV,Kalli,Lilliman,klilliman89@geocities.jp,Women's College of Fine Arts
Lang Group,Project Manager,Neila,Stringman,nstringman8a@photobucket.com,Universidade São Francisco
Cole LLC,Accountant IV,Chris,Bernot,cbernot8b@fastcompany.com,"Islamic Azad University, Qazvin"
Ryan-Ferry,Clinical Specialist,Bibby,Roelofs,broelofs8c@sitemeter.com,Universidade de Alfenas
"Schmidt, Mertz and Thompson",VP Accounting,Lydie,Haskur,lhaskur8d@pinterest.com,The McGregor School of Antioch University
Hintz-Homenick,Assistant Media Planner,Sherlocke,Glendining,sglendining8e@hugedomains.com,Universidad Autónoma del Paraguay
Kuhic-Roob,Programmer Analyst II,Vin,Inchan,vinchan8f@linkedin.com,Université Catholique de Lille
Batz-Morar,Clinical Specialist,Zena,Plett,zplett8g@unicef.org,I-Shou University
"Blanda, Konopelski and Ledner",Marketing Assistant,Ruddy,Whibley,rwhibley8h@typepad.com,Sterlitamak State Pedagogical Institute
"Renner, Glover and Tillman",Marketing Manager,Alida,Palleske,apalleske8i@phpbb.com,Tampere Polytechnic
Ledner-Trantow,Help Desk Technician,Rodolphe,Golby,rgolby8j@mit.edu,Universidade Estadual do Ceará
Windler Inc,Senior Developer,Anallise,Juggins,ajuggins8k@fastcompany.com,"University of the East, Manila"
"Mraz, Anderson and Romaguera",Web Developer IV,Aubrey,Bruno,abruno8l@ucla.edu,Norwegian School of Management BI
Rempel LLC,Analog Circuit Design manager,Clarie,Vuitton,,Universidad de la Empresa (UDE)
Dibbert-VonRueden,Account Representative IV,Howey,Riddock,hriddock8n@deviantart.com,Southwestern Adventist University
Beatty and Sons,Biostatistician II,Ximenes,Hassey,xhassey8o@1688.com,University of Ballarat
Rice-Mills,Associate Professor,Joane,Lissenden,jlissenden8p@oakley.com,Belarusian-Russian University
"Cremin, Bode and Pagac",Research Nurse,Tobiah,Lilburn,tlilburn8q@creativecommons.org,International Business University of Beijing
Bogan-Hills,Editor,Elizabeth,Ridder,eridder8r@ca.gov,Khurasan University
White LLC,Human Resources Assistant III,Laurens,Tomasicchio,ltomasicchio8s@parallels.com,"Universitatea de Vest ""Vasile Goldi&#351;"" "
"Mills, Dare and Kunde",Administrative Officer,Arda,Pittle,apittle8t@yahoo.co.jp,Agricultural University of Plovdiv
"VonRueden, Lindgren and Luettgen",Environmental Specialist,Chrissy,Ailmer,cailmer8u@hhs.gov,Louisiana State University in Shreveport
Lindgren Inc,Operator,Gratia,Weiss,gweiss8v@prlog.org,Shanghai Television University
"Bednar, Dickinson and Ryan",General Manager,Othilia,Hazle,,"Univerzitet u Mostaru ""Dzemal Bijedic"""
Harris-Monahan,Payment Adjustment Coordinator,Avrit,Handmore,ahandmore8x@linkedin.com,Academy of the Ministry of Internal Affairs of the Republic of Belarus
Lockman-Yost,Speech Pathologist,Jocelin,Spittles,jspittles8y@github.io,Marshall University
Hartmann LLC,Senior Cost Accountant,Boyd,Corrin,bcorrin8z@indiatimes.com,Cambridge College
Mraz Group,Senior Cost Accountant,Freedman,Witherspoon,fwitherspoon90@ning.com,Elon College
Mitchell-Leannon,Administrative Officer,Darda,Adshede,dadshede91@bloglovin.com,University of Central Lancashire
"Hahn, Hilll and Baumbach",Nurse,Clarita,Zavattari,czavattari92@fc2.com,University of North Carolina at Wilmington
"Bernier, Hickle and Hamill",VP Accounting,Pyotr,Kief,pkief93@samsung.com,Ecole Supérieure de Commerce de Lyon
Bauch Inc,Associate Professor,Genevieve,Duester,gduester94@gmpg.org,Nara Sangyo University
Greenfelder-Cremin,Registered Nurse,Nicko,Downham,ndownham95@miitbeian.gov.cn,Centre National d'Etudes Agronomiques des Régions Chaudes
Haag Inc,Developer IV,Flor,Keling,,Universidade de São Paulo
Swift LLC,Technical Writer,Nanci,Selland,nselland97@ehow.com,Mozyr State Pedagogical Institute
"Baumbach, Stoltenberg and Jerde",VP Accounting,Kerrill,Taunton,ktaunton98@java.com,Oakton Community College
"Lueilwitz, Kihn and Bednar",Recruiting Manager,Freeland,Mardy,fmardy99@nasa.gov,University of Jan Evangelista Purkyne
Stanton Group,Sales Associate,Vanya,Sweeten,vsweeten9a@deliciousdays.com,Indiana University (System)
"Bashirian, Brekke and Greenholt",Technical Writer,Ameline,Haugh,ahaugh9b@webnode.com,University Lucian Blaga of Sibiu
Thompson-Kunde,Account Representative II,Carmina,McSkin,cmcskin9c@dell.com,Madison University (Distance Education)
Fisher Inc,Dental Hygienist,Sher,Craney,scraney9d@instagram.com,Kazan State University
Pfannerstill-Hegmann,Research Associate,Malchy,MacNulty,mmacnulty9e@shareasale.com,Universidade de Brasília
"Kovacek, Grant and Yost",Community Outreach Specialist,Maximo,Bruckmann,mbruckmann9f@xing.com,Instituto Universitario de Estudios Navales y Marítimos
Senger and Sons,Occupational Therapist,Rem,Saur,rsaur9g@parallels.com,Batchelor Institute of Indigenous Tertiary Education
Hane-Larkin,Programmer Analyst IV,Craggy,Cully,ccully9h@newsvine.com,Universidade Estadual da Paraíba
"Weber, MacGyver and Koss",Sales Associate,Wash,Deinhard,wdeinhard9i@nasa.gov,Universidad de Atacama
"West, Breitenberg and Bergstrom",VP Marketing,Cesaro,Seeborne,cseeborne9j@ftc.gov,Bradley University
Wyman-Predovic,Librarian,Hadrian,Wordley,hwordley9k@pbs.org,Imam Khomeini International University
"Wintheiser, Haley and Schamberger",Software Engineer II,Toinette,Arunowicz,tarunowicz9l@webs.com,St. Andrews Presbyterian College
Mills LLC,Legal Assistant,Aurilia,Adam,aadam9m@posterous.com,Dimocritus University of Thrace
Dickens-Parker,Engineer II,Annabell,Legrave,alegrave9n@kickstarter.com,Kharkiv State Transport Technical University
"Boyer, Swaniawski and Beahan",Account Coordinator,Rahel,Kidder,rkidder9o@yellowbook.com,Universidade da Amazônia
Grady and Sons,Administrative Officer,Benjamin,Kleiner,bkleiner9p@1688.com,Ecole Supérieure de Commerce de Rouen
"Nitzsche, Hoeger and Dooley",Information Systems Manager,Angele,Darridon,adarridon9q@squidoo.com,Open University of Israel
Dach LLC,Human Resources Manager,Winny,Tarver,wtarver9r@com.com,Suffolk University
Marvin and Sons,Project Manager,Lanie,Lea,llea9s@marketwatch.com,"Fachhochschule Nürtingen, Hochschule für Wirtschaft, Landwirtschaft und Landespflege"
McClure-Champlin,Food Chemist,Fania,Firbanks,ffirbanks9t@hp.com,Bhagwant University
"Baumbach, Corkery and Spinka",Help Desk Technician,Antonia,Pipes,apipes9u@godaddy.com,Mokpo National University
Runolfsdottir Group,Social Worker,Morty,Bentley,mbentley9v@arstechnica.com,Igbinedion University
"Mitchell, Williamson and Kertzmann",Media Manager IV,Tessa,Durtnal,tdurtnal9w@answers.com,Southern Wesleyan University
"Bosco, Schumm and Hyatt",Professor,Paulina,Whild,pwhild9x@biblegateway.com,Universidad del Mar
"Lesch, Schuster and Adams",Geological Engineer,Kirk,Mutton,kmutton9y@ycombinator.com,Caritas University
Rempel LLC,Health Coach III,Kippie,Frontczak,kfrontczak9z@unesco.org,University of Colorado at Boulder
Jenkins-Green,Accounting Assistant I,Odetta,Eadmeades,oeadmeadesa0@merriam-webster.com,International Islamic College of Penang
"Leuschke, Johns and Ankunding",Chief Design Engineer,Dani,Brumbie,dbrumbiea1@cbc.ca,Universidad de Manizales
Wiza-Prosacco,Information Systems Manager,Druci,Chasle,dchaslea2@infoseek.co.jp,Martin University
"Bahringer, Gottlieb and Terry",Food Chemist,Lyndsie,Willoughway,lwilloughwaya3@printfriendly.com,Université de la Méditerranée (Aix Marseille II)
Douglas Inc,Financial Advisor,Rivkah,Winspurr,rwinspurra4@addthis.com,Anglia Ruskin University
Heathcote-Donnelly,Systems Administrator IV,Riobard,Ingolotti,ringolottia5@ebay.co.uk,Universidade Federal Fluminense
"Torphy, Schowalter and Crona",Systems Administrator I,Roberta,Dessaur,rdessaura6@mac.com,New England Conservatory of Music
Hand-Gleason,VP Sales,Dalt,Tripp,dtrippa7@msu.edu,Universidad Catolica de Temuco
"Armstrong, Shields and Mayert",Human Resources Manager,Minetta,Gummoe,mgummoea8@blogtalkradio.com,Wiley College
"O'Connell, Jacobson and Mohr",Occupational Therapist,Elnora,Wegenen,ewegenena9@yellowbook.com,Charleston Southern University
"Schulist, Lueilwitz and Parisian",Clinical Specialist,Porter,Closs,pclossaa@loc.gov,University of North Carolina at Greensboro
Herman-Bailey,VP Quality Control,Janaye,Mottershaw,jmottershawab@ezinearticles.com,Universidad Fundepos Alma Mater
Hagenes-Stark,Statistician II,Isacco,Sancto,isanctoac@jugem.jp,Deutsche Telekom Fachhochschule Leipzig
Sawayn and Sons,VP Product Management,Townie,Bagley,tbagleyad@eepurl.com,Eastern Conservatory of Music
"Bernier, Monahan and Lockman",Office Assistant IV,Aguie,Febre,afebreae@wikipedia.org,Mount Vernon College
"Johnston, Walter and Jast",Structural Engineer,Kevon,Matteacci,kmatteacciaf@miibeian.gov.cn,Sichuan Agricultural University
Jacobi and Sons,Staff Accountant II,Bernette,Greenless,bgreenlessag@loc.gov,University of Oslo
"Rogahn, Johns and Rogahn",Staff Accountant II,Shoshanna,Shoulder,sshoulderah@adobe.com,Universidad Central del Este
Klocko-Howe,Budget/Accounting Analyst II,Charlotta,Demageard,,Touro College
Schinner Group,Senior Developer,Abeu,Bradneck,abradneckaj@sphinn.com,North Carolina School of the Arts
Rolfson-Howe,Senior Financial Analyst,Washington,Sumpner,wsumpnerak@delicious.com,Universidad del Valle del Cauca
Collier Inc,Geologist III,Conny,Branch,cbranchal@chron.com,Universidad NUR
Kuhic Group,Research Nurse,Kerrie,Rootham,kroothamam@tiny.cc,Karnataka State Law University
Ebert Inc,Nuclear Power Engineer,Zackariah,McLeish,zmcleishan@prweb.com,University of Wassit
Yost Inc,Librarian,Angelle,Dael,adaelao@exblog.jp,"Rutgers, The State University of New Jersey - Newark"
"Leuschke, Romaguera and Hansen",Staff Accountant III,Heidi,Morcombe,hmorcombeap@reddit.com,Timirjazev Moscow Academy of Agricultutre
"Bruen, Gerhold and Nitzsche",Senior Cost Accountant,Emilie,Knott,eknottaq@aboutads.info,Willamette University
Feil-Pacocha,Financial Analyst,Jackquelin,Bloan,jbloanar@ebay.com,National University of Kaohsiung
Howe LLC,Legal Assistant,Cristy,Gregoretti,cgregorettias@walmart.com,Centro Universitário Monte Serrat
"Schmitt, Reichert and Hickle",Account Executive,Andree,Allwell,aallwellat@trellian.com,Universitas Muslim Indonesia
"Gusikowski, Abbott and Hilll",Information Systems Manager,Milo,Garlee,mgarleeau@wordpress.com,National Yunlin University of Science and Technology
Dare and Sons,Recruiter,Kimberli,Barnaclough,kbarnacloughav@ucsd.edu,Akita University
Schiller-Schaefer,Engineer IV,Daveta,Edgeller,dedgelleraw@springer.com,Technological University (Loikaw)
Wiza LLC,Junior Executive,Stevy,Badder,sbadderax@usa.gov,State University of New York Downstate Medical Center
Tremblay-Russel,Assistant Media Planner,Pall,Crecy,pcrecyay@surveymonkey.com,Universidad Adolfo Ibáñez
Bergnaum Group,Software Engineer IV,Dionisio,Beckham,dbeckhamaz@toplist.cz,Universidad Juan Misael Saracho
McClure-Mueller,Marketing Manager,Devon,Kick,dkickb0@oakley.com,University of Lucknow
"Hirthe, Blanda and Schmidt",Environmental Specialist,Caresse,Wince,cwinceb1@meetup.com,"Fachhochschule Schwäbisch Hall, Hochschule für Gestaltung"
Gibson Group,Legal Assistant,Leroi,Trewhitt,ltrewhittb2@bigcartel.com,St. Luke' s College of Nursing
Huel Group,Project Manager,Munroe,Lodwig,mlodwigb3@themeforest.net,O'More College of Design
"Franecki, Tremblay and Pfannerstill",Speech Pathologist,Bert,Farlane,bfarlaneb4@icq.com,University of Lusaka
Renner and Sons,Software Consultant,Alexandrina,Wolseley,awolseleyb5@tripadvisor.com,University of Tennessee - Memphis
Willms-Morar,Research Associate,Nickola,Cullnean,ncullneanb6@geocities.jp,Colorado School of Mines
Terry-Kuvalis,Mechanical Systems Engineer,Rosemaria,McGinnell,rmcginnellb7@nsw.gov.au,Balqa Applied University
"Pfannerstill, Davis and Bogan",Software Consultant,Honor,Castell,hcastellb8@com.com,Toho Gakuen School of Music
"Jerde, Botsford and Smitham",Administrative Officer,Horst,Duthy,hduthyb9@php.net,Technological University of Podillya
Gottlieb Inc,Software Consultant,Elsworth,MacPharlain,emacpharlainba@yellowpages.com,Mayo Medical School
"Legros, Swaniawski and Gulgowski",Legal Assistant,Gwenette,Skillitt,gskillittbb@odnoklassniki.ru,New York Film Academy
"Gerhold, Goyette and Flatley",Database Administrator II,Mavis,Christou,mchristoubc@earthlink.net,Norwegian State Academy of Music
Pagac-Kovacek,Staff Scientist,Lelia,Shurmer,lshurmerbd@buzzfeed.com,"Rajamangala University of Technology, Lanna Nan"
"Pfannerstill, Schaefer and Okuneva",Engineer III,Levon,Mokes,lmokesbe@hud.gov,Qom University
Jacobs-Douglas,Physical Therapy Assistant,Glen,Mogford,gmogfordbf@unblog.fr,Institut Teknologi Brunei
Kihn-Carter,Analog Circuit Design manager,Miner,Curm,mcurmbg@sina.com.cn,"Federal Urdu University of Arts,Science and Technology"
Eichmann Inc,Project Manager,Adams,Andell,aandellbh@ebay.com,Kyoto Institute of Technology
Carroll and Sons,Administrative Assistant III,Pauly,Danzig,pdanzigbi@chron.com,"Fachhochschule Konstanz, Hochschule für Technik, Wirtschaft und Gestaltung"
Roob-Considine,Research Associate,Carmella,Goaley,,Universitas Pesantren Darul Ulum Jombang
"Quigley, Abshire and Emard",Data Coordiator,Vi,Bohman,vbohmanbk@mlb.com,University of Lecce
Pfeffer-Nolan,General Manager,Michal,Rearie,mreariebl@about.com,Gulf University for Science and Technology
"Block, Stokes and Satterfield",Nurse Practicioner,Jacobo,Dolligon,jdolligonbm@sphinn.com,Jinan University
Witting LLC,Chief Design Engineer,Cirstoforo,Le Prevost,cleprevostbn@nydailynews.com,Cumberland University
Weber-Turner,Budget/Accounting Analyst IV,Veradis,Rampley,vrampleybo@wix.com,Jamia Hamdard University
Rath Inc,Structural Engineer,Mair,Newgrosh,mnewgroshbp@cnbc.com,Universidade Federal do Ceará
Skiles Inc,Geological Engineer,Wandis,Wheeler,wwheelerbq@imdb.com,National College of Ireland
"Weber, Stracke and Schinner",Internal Auditor,Felicity,Meadowcraft,fmeadowcraftbr@ustream.tv,I-Shou University
"Kautzer, Shields and Raynor",Clinical Specialist,Jaynell,Duffan,jduffanbs@com.com,Southeastern Oklahoma State University
"Purdy, Goyette and Zemlak",Payment Adjustment Coordinator,Billi,Werny,bwernybt@google.pl,Internationle Akademie für Philosophie
O'Conner-Willms,Recruiting Manager,Alyssa,Bretherick,abretherickbu@hexun.com,Torbat Heydarieh University of Medical Sciences
"Cummings, Pfeffer and Dickens",Web Developer IV,Druci,Scarlon,dscarlonbv@fda.gov,Bratislava International School of Liberal Arts
Murazik Inc,Software Test Engineer IV,Gaven,Wison,gwisonbw@miitbeian.gov.cn,Catholic University of Korea
Grant-Thompson,Associate Professor,Andre,Simkins,asimkinsbx@de.vu,Adelphi University
Buckridge-Weissnat,Information Systems Manager,Ruy,Creffeild,rcreffeildby@studiopress.com,Dalian University
"Okuneva, Toy and Homenick",Payment Adjustment Coordinator,Worthington,Emblow,wemblowbz@stanford.edu,Cabrini College
Schulist Inc,Professor,Violante,Doerr,vdoerrc0@1688.com,Universitas Jambi
"Anderson, McKenzie and Schroeder",Administrative Officer,Noelani,Duggen,nduggenc1@typepad.com,University of Notre Dame
"Rutherford, Grady and Pagac",Database Administrator IV,Denys,Mesnard,dmesnardc2@amazon.co.jp,Anglia Ruskin University
"Runolfsson, Bartell and Homenick",Staff Accountant IV,Whitman,Klimmek,wklimmekc3@comsenz.com,Shanghai University of Science and Technology
"Reinger, Cummings and Corkery",Developer III,Filberto,Cristofalo,fcristofaloc4@cyberchimps.com,China University of Geoscience Beijing
Wolff-Zboncak,Research Associate,Marnia,Ogborn,mogbornc5@sakura.ne.jp,California Coast University
Leffler-Koss,Geologist IV,Jasmina,Bennet,jbennetc6@cam.ac.uk,Daiichi University of Economics
Metz LLC,Research Nurse,Junie,Esposi,jesposic7@disqus.com,St Theresa's Medical University
Heaney LLC,Database Administrator III,Corney,Duetschens,cduetschensc8@edublogs.org,Franklin and Marshall College
Boyle and Sons,Registered Nurse,Sandie,Ludlow,sludlowc9@mediafire.com,Universidad de Málaga
"Bashirian, Runolfsson and Ratke",Administrative Assistant IV,Modesta,Veness,mvenessca@ucoz.com,Takhar University
Osinski Inc,Clinical Specialist,Charin,Caffin,ccaffincb@dot.gov,Escuela Superiore de Administración Pública
"McKenzie, Kuhlman and Koelpin",Web Designer III,Arlina,Kornousek,akornousekcc@epa.gov,Qingdao University of Science and Technology
"Kuhlman, Watsica and Ratke",Structural Analysis Engineer,Dasha,Girodias,dgirodiascd@deliciousdays.com,Université Senghor d'Alexandrie
"Wilderman, Carroll and Hoeger",Developer II,Culver,Juris,,University of Massachusetts at Dartmouth
Jakubowski-Ratke,Occupational Therapist,Mord,Botley,mbotleycf@about.me,Zanjan University of Medical Sciences
"Trantow, Lang and Becker",VP Sales,Chas,Kincade,ckincadecg@miibeian.gov.cn,Dominion College
Botsford Inc,Budget/Accounting Analyst II,Byrom,Crispin,bcrispinch@csmonitor.com,Universidade Federal de Rondônia
Huel-Hills,Food Chemist,Bronnie,Fredy,bfredyci@moonfruit.com,Mount Sinai School of Medicine
Cassin and Sons,Physical Therapy Assistant,Chip,Bottelstone,cbottelstonecj@walmart.com,Adnan Menderes University
Lemke and Sons,Systems Administrator IV,Zollie,Shewen,zshewenck@istockphoto.com,University of Sri Jayawardenapura
"Conroy, Bayer and Considine",Physical Therapy Assistant,Jorey,Sabattier,jsabattiercl@apache.org,John Cabot University
"McDermott, Paucek and Gusikowski",Clinical Specialist,Joellen,Keynd,jkeyndcm@twitter.com,Universidad Nacional Mayor de San Marcos
"O'Connell, Rodriguez and Schumm",Environmental Specialist,Neron,Ilott,nilottcn@eventbrite.com,University of Rijeka
Conn LLC,Registered Nurse,Brig,Gravell,bgravellco@techcrunch.com,Universidad Santa Maria Caracas
"Turcotte, Blick and O'Reilly",Help Desk Operator,Thedric,Symers,tsymerscp@sohu.com,Universidad San Juan de la Cruz
Hagenes Group,Technical Writer,Vanni,Slograve,vslogravecq@facebook.com,Universität Osnabrück
"Kerluke, Dietrich and Dickinson",Payment Adjustment Coordinator,Horatia,Caiger,hcaigercr@state.tx.us,Technological University (Kyaing Tong)
Kertzmann-Grady,Help Desk Operator,Rooney,Rocca,rroccacs@chron.com,Hokkaigakuen University of Kitami
Ankunding-Legros,Executive Secretary,Mylo,Lack,mlackct@goo.ne.jp,Nishinippon Institute of Technology
Tillman LLC,Professor,Theressa,Nichol,tnicholcu@blog.com,Wudanshan Taoist College 
"Rodriguez, Wolf and Strosin",VP Accounting,Adey,Conneely,aconneelycv@google.com,Abdus Salam international centre for theoretical physics
Walter LLC,Executive Secretary,Marlowe,Grimbaldeston,mgrimbaldestoncw@imgur.com,Northern Caribbean University
"Hodkiewicz, Batz and Doyle",Structural Engineer,Arabelle,Storer,astorercx@prlog.org,Universidad Nacional Federico Villarreal
Volkman-Volkman,Senior Quality Engineer,Jamison,Dunsleve,jdunslevecy@mlb.com,Universidad Autónoma de Querétaro
Kuphal and Sons,Chemical Engineer,Larisa,Bake,,City University Programs in Bulgaria 
"Ratke, Jast and Cremin",Structural Analysis Engineer,Decca,Wint,dwintd0@pcworld.com,Suwon Catholic University
Koepp Inc,Accountant IV,Austina,Leavesley,aleavesleyd1@free.fr,Dartmouth College
Rosenbaum LLC,VP Product Management,Mervin,Bourdas,mbourdasd2@wikimedia.org,Södertörn University College
"Sawayn, McClure and Rippin",Editor,Elga,Walsh,ewalshd3@cdc.gov,Georgetown University
Lehner Group,Accounting Assistant III,Talbert,Armit,tarmitd4@europa.eu,University of Karachi
"Hahn, Hirthe and Bashirian",Clinical Specialist,Arin,Menier,amenierd5@pcworld.com,Lucerne University of Applied Sciences and Arts 
Kozey-Green,Engineer I,Wilmer,Dmitrienko,wdmitrienkod6@cam.ac.uk,University of Hargeisa
"Tromp, Dietrich and Thompson",Director of Sales,Constancy,Simm,csimmd7@icio.us,Katsina University
"Hamill, Witting and Oberbrunner",Tax Accountant,Pris,Hencke,phencked8@prweb.com,State University of New York (SUNY)
"Howe, Thiel and Schuppe",Payment Adjustment Coordinator,Mickie,Sussems,msussemsd9@xing.com,Auburn University
Bins-Brown,Analyst Programmer,Janaya,Bucher,,Koya University (Kurdistan Region)
Ortiz-Metz,Office Assistant IV,Correy,Orvis,corvisdb@facebook.com,Université de 7 Novembre à Carthage
Fadel and Sons,Statistician II,Nettie,McCauley,nmccauleydc@spotify.com,Ecole Supérieure de Commerce de Grenoble
