CURRENT COMPANY,JOB TITLE,FIRST NAME,LAST NAME,EMAIL,UNIVERSITY
Harvey Inc,Safety Technician IV,Ardelia,Winspurr,awinspurr0@timesonline.co.uk,Universidad Autónoma de Yucatán
Johnston-Hermann,Structural Engineer,Ileane,Balhatchet,ibalhatchet1@fastcompany.com,Technical University of Opole
Dibbert-Lemke,Human Resources Assistant III,Damita,Seamer,dseamer2@elegantthemes.com,Osaka City University
"Rutherford, Schiller and Skiles",Staff Accountant III,Krystal,Clerc,kclerc3@lulu.com,"DeVry Institute of Technology, Decatur"
"Luettgen, Anderson and Green",Automation Specialist III,Kirsti,Raithbie,kraithbie4@liveinternet.ru,University of Maryland Medicine
"Goldner, Skiles and Huels",Project Manager,Ingrid,Louis,ilouis5@slashdot.org,Nuclear Institute for Agriculture and Biology (NIAB)
Nader LLC,Occupational Therapist,Lesli,Murdoch,lmurdoch6@canalblog.com,Mahidol University
"Wilderman, Stanton and Orn",Graphic Designer,Xavier,Risbie,xrisbie7@nifty.com,Ranchi University
Cruickshank Group,Recruiting Manager,Bernadene,Lisamore,blisamore8@phpbb.com,Joetsu University of Education
"Schneider, Mante and O'Kon",Senior Quality Engineer,Filippa,Gerren,fgerren9@google.co.uk,Sadat Institute of Higher Education
Borer-Ruecker,Pharmacist,Casandra,Raphael,craphaela@imdb.com,Universidade Potiguar
Stiedemann-Cummerata,Dental Hygienist,Georges,Shildrake,,Institute of Accountancy Arusha
"Hintz, Schmeler and Schaefer",Quality Control Specialist,Odell,Cordingly,ocordinglyc@zimbio.com,Universidade Católica de Santos
Crist Group,Senior Developer,Paula,Collishaw,pcollishawd@examiner.com,"Merz Akademie, Hochschule für Gestaltung Stuttgart"
Treutel LLC,Marketing Manager,Bernetta,Bengoechea,bbengoecheae@slideshare.net,Ecole Nationale Supérieure des Mines de Douai
"Waelchi, Schiller and Maggio",Web Developer III,Krystle,McGhie,kmcghief@tinyurl.com,St. Elizabeth’s College of Health and Social Sciences in Bratislava
Pfeffer LLC,Computer Systems Analyst III,Lemmie,Spelwood,lspelwoodg@alibaba.com,Politeknik Negeri Sambas
Casper-Stehr,Speech Pathologist,Ruy,Roddell,rroddellh@delicious.com,Universitas Mahasaraswati Denpasar
Prosacco Group,Executive Secretary,Yorker,Manicomb,ymanicombi@drupal.org,"Universidad Nacional Experimental ""Simón Rodriguez"""
Boyle Group,Dental Hygienist,Fulton,Martensen,fmartensenj@tmall.com,Urumqi Vocational University
Okuneva-Lebsack,Accountant II,Trisha,Tayt,ttaytk@walmart.com,Universidade Bandeirante de São Paulo
Johnson-Lehner,Computer Systems Analyst III,Madison,Demogeot,,Ecole Supérieure de Commerce et des Affaires
Kessler-Barrows,Staff Accountant IV,Jeff,Petchey,jpetcheym@newsvine.com,Universidad Panamericana
"Zieme, Leffler and Ebert",Assistant Professor,Odette,Shinn,oshinnn@ox.ac.uk,Hiroshima University of Economics
"Roob, Hoeger and Zboncak",Financial Advisor,Anneliese,Morriarty,amorriartyo@hibu.com,Hawassa University
"Turner, O'Hara and Schimmel",Recruiter,Mackenzie,Gabb,mgabbp@abc.net.au,College of Technology at Jazan
Pacocha-Vandervort,Chemical Engineer,Mahala,Clail,mclailq@forbes.com,Universidad de La Salle
Berge-Franecki,Nurse,Abrahan,Lampen,alampenr@canalblog.com,Faculté Polytechnique de Mons
Roob Inc,Tax Accountant,Rikki,des Remedios,rdesremedioss@irs.gov,University of the Philippines Baguio
"Orn, Kertzmann and Hermann",Human Resources Assistant II,Marthena,Denes,mdenest@dion.ne.jp,University of Agriculture and Veterinary Medicine Iasi
Schimmel-Feil,Account Executive,Lea,Craiker,lcraikeru@pagesperso-orange.fr,The Superior College 
Cruickshank-Little,Human Resources Assistant II,Derek,Brundle,dbrundlev@nps.gov,Universidad Rey Juan Carlos
Bartell-Feest,Teacher,Calypso,Kopps,ckoppsw@accuweather.com,Universität für angewandte Kunst Wien
Hettinger-Mueller,Assistant Professor,Nannette,Bimson,nbimsonx@nasa.gov,Universidad de Antofagasta
O'Keefe-Corkery,Structural Engineer,Flemming,Durand,fdurandy@patch.com,Universidad Catolica de La Santísima Concepción
Vandervort-Littel,Community Outreach Specialist,Merrill,Pharro,mpharroz@friendfeed.com,Napier University
"O'Connell, Ullrich and Murray",Analog Circuit Design manager,Leonore,Pickering,,Lazarski School of Commerce and Law
Swift LLC,Engineer IV,Lorin,Duckworth,lduckworth11@hibu.com,Marymount University
Bogan LLC,Technical Writer,Titus,Fellnee,tfellnee12@opera.com,Gandhara Institute of Medical Sciences
Welch-Corwin,GIS Technical Architect,Den,Hedney,dhedney13@unesco.org,Dawat University
Lynch and Sons,Chemical Engineer,Harp,Benedetti,hbenedetti14@qq.com,Fachhochschule Bonn-Rhein-Sieg
"Lynch, Wunsch and Gusikowski",Statistician IV,Brooks,Satterthwaite,bsatterthwaite15@shutterfly.com,Laboratory Institute of Merchandising
Hoppe and Sons,Technical Writer,Neale,Farn,nfarn16@apple.com,Kirchliche Hochschule Bethel
Hettinger Inc,Associate Professor,Brianna,Mackrill,bmackrill17@jimdo.com,University of North Bengal
Cummings and Sons,Automation Specialist I,Madella,Coatsworth,mcoatsworth18@devhub.com,University of Osijek
Luettgen-Heller,Analyst Programmer,Aida,Dobsons,adobsons19@illinois.edu,University of Bath
"Parker, Mann and Hauck",Nuclear Power Engineer,Aeriela,Curner,acurner1a@com.com,University of Plovdiv
Quitzon-Tillman,Data Coordiator,Marlow,Pratchett,mpratchett1b@ifeng.com,Illinois Institute of Technology
Konopelski-Johns,Environmental Tech,Elladine,Cromblehome,ecromblehome1c@webeden.co.uk,Konan Women's University
"Botsford, Mayer and Schuppe",Software Consultant,Bourke,Atling,batling1d@newsvine.com,Hefei University of Technology
"Jenkins, Batz and Runolfsson",Payment Adjustment Coordinator,Lynnet,Bareford,lbareford1e@163.com,Maakhir University
"Franecki, Erdman and Medhurst",Web Developer III,Leena,Keeler,lkeeler1f@ucla.edu,University Konstantina Filozov in Nitra
Cummings Group,Civil Engineer,Erv,Verrechia,everrechia1g@com.com,Chengdu University of Technology
"Raynor, Wiza and Bode",Systems Administrator III,Pascale,Durtnal,pdurtnal1h@bloglovin.com,Uganda Martyr's University
Nitzsche LLC,Help Desk Operator,Trey,Rego,trego1i@yellowbook.com,"Embry Riddle Aeronautical University, Prescott"
"VonRueden, Gorczany and Ernser",Librarian,Tucker,Kays,tkays1j@army.mil,Shippensburg University of Pennsylvania
Runolfsson-Walter,Financial Advisor,Adolf,Greatbach,agreatbach1k@amazonaws.com,African University of Science and Technology
"Heaney, Mraz and Ernser",Nurse Practicioner,Dena,Goncalo,dgoncalo1l@nyu.edu,University of North West
"Dach, Marquardt and Sanford",Occupational Therapist,Marcelle,Truitt,mtruitt1m@technorati.com,Universidad Michoacana de San Nicolás de Hidalgo
Jenkins Inc,VP Accounting,Gerrie,Kinneir,gkinneir1n@slate.com,Canterbury Christ Church University
Hermiston Group,Health Coach I,Lizzy,Czyz,lczyz1o@wikia.com,Prague College
"Wilkinson, Auer and Davis",Chief Design Engineer,Natividad,Paviour,npaviour1p@go.com,Torbat Heydarieh University of Medical Sciences
"Wiegand, Runolfsson and D'Amore",Dental Hygienist,Eal,Dossantos,edossantos1q@noaa.gov,Martin Methodist College
Lang Inc,Design Engineer,Adelind,Laidler,alaidler1r@sourceforge.net,Southampton Solent University
Botsford-Lebsack,Account Representative III,Tandie,Dumphries,tdumphries1s@xrea.com,Sichuan Normal University
"Gulgowski, Mertz and Stark",Design Engineer,Ula,Dudden,ududden1t@xrea.com,"Indian Institute of Management, Tiruchirappalli"
"Crist, Stanton and Haag",Operator,Kristofor,Mollon,kmollon1u@va.gov,Politeknik Negeri Sambas
"Johns, Cruickshank and Mills",Senior Quality Engineer,Jemima,Nobles,jnobles1v@ameblo.jp,Ecole Supérieure de Chimie Physique Electronique de Lyon
D'Amore Group,Assistant Media Planner,Jo ann,Szubert,jszubert1w@163.com,Dartmouth College
"Wiegand, Ritchie and Will",VP Sales,Morly,Rodriguez,mrodriguez1x@java.com,Knowledge College for Science and Technology
Wiegand Group,Account Executive,Stefan,Riste,sriste1y@prnewswire.com,Osaka University of Education
Gottlieb LLC,Graphic Designer,Ulrika,Kohrt,,Hochschule für Politik (HFP)
Von-Waelchi,Professor,Tiffi,Musslewhite,tmusslewhite20@telegraph.co.uk,Caribbean University
Wilderman Inc,Marketing Manager,Delores,Peace,dpeace21@ovh.net,Universidad Modular Abierta
"Rogahn, Yundt and Durgan",Human Resources Assistant III,Flore,Ashplant,fashplant22@mayoclinic.com,Lagos State University
"Blick, Sipes and Nienow",Health Coach III,Dion,Espina,despina23@reverbnation.com,Tyumen State University
"Koch, Daniel and Doyle",Legal Assistant,Aurore,Poge,apoge24@tinypic.com,Puntland State University
"Hermiston, Gusikowski and Lebsack",Computer Systems Analyst III,Bucky,Benardette,bbenardette25@trellian.com,Tokyo Denki University
Harber-Frami,Quality Control Specialist,Pierson,Alanbrooke,palanbrooke26@google.pl,Kingston University
Johnson Group,Social Worker,Free,Franzonetti,ffranzonetti27@tiny.cc,International School of Management ISM Dortmund
Kihn-Maggio,Social Worker,Rica,Goodee,rgoodee28@ed.gov,Korea University
Von and Sons,Budget/Accounting Analyst II,Karlie,Hugk,,Cardinal Stefan Wyszynski University in Warsaw
Mann-Wunsch,Operator,Maddi,Brogden,mbrogden2a@springer.com,Pedagogical University of Slupsk
"Wisoky, Barrows and Feeney",Senior Cost Accountant,Orv,Clinning,oclinning2b@stanford.edu,University of Hail
Glover Inc,Senior Editor,Tierney,Bankhurst,tbankhurst2c@un.org,Emory & Henry College
Zieme-Keebler,Analyst Programmer,Gorden,Glisane,gglisane2d@webeden.co.uk,Private Hanseuniversität
Gleichner Inc,Research Nurse,Jay,Guillond,jguillond2e@spotify.com,Nippon Bunri University
Sanford-Raynor,Legal Assistant,Filip,Kollas,fkollas2f@tmall.com,King Mongkut's University of Technology Thonburi
Streich Inc,Community Outreach Specialist,Wernher,Michurin,wmichurin2g@chron.com,Allianze College of Medical Sciences (ACMS)
"McDermott, Hyatt and Raynor",Research Associate,Janos,Thoumas,jthoumas2h@dedecms.com,Royal University of Phnom Penh
Okuneva Inc,Developer III,Royce,Westraw,rwestraw2i@reddit.com,Georgia School of Professional Psychology
Stiedemann-Labadie,Marketing Manager,Beverley,Licciardi,blicciardi2j@jugem.jp,Tula State University
Murray Group,Mechanical Systems Engineer,Zsazsa,Slyvester,,Bluffton College
Welch and Sons,Administrative Assistant IV,Earvin,Stiff,estiff2l@dailymotion.com,Pioneer International University
"Jacobi, Rohan and Walter",Account Representative I,Giustino,Grinikhinov,ggrinikhinov2m@webmd.com,Yangtze University
Mills-Kutch,Pharmacist,Eziechiele,Moxsom,emoxsom2n@usnews.com,Instituto Politécnico de Viana do Castelo
Fadel Inc,Chemical Engineer,Vikky,Broadfield,vbroadfield2o@va.gov,EHSAL - Europese Hogeschool Brussel
Bayer Inc,Project Manager,Hymie,Alyonov,,Teikyo University of Science and Technology
Grady-Zboncak,Editor,Etty,Lackner,elackner2q@topsy.com,Kyungpook National University
"D'Amore, Jacobson and Wolff",Accountant III,Merell,Else,melse2r@wunderground.com,Guizhou University
Feeney-Reynolds,General Manager,Gabie,Stooders,gstooders2s@foxnews.com,West Suburban College of Nursing
"Dickinson, Gutmann and Dach",Desktop Support Technician,Ingelbert,Domb,idomb2t@illinois.edu,Silesian University
Bartell-Hintz,VP Marketing,Bary,Schaffel,bschaffel2u@chronoengine.com,Aegean University
"Turner, Hand and Collins",Assistant Professor,Dru,Sandy,dsandy2v@skyrock.com,Institut National Polytechnique de Lorraine
Fahey Inc,Software Engineer IV,Myles,Robbeke,mrobbeke2w@tuttocitta.it,University of Tennessee - Knoxville
"Runolfsson, Ortiz and Champlin",Administrative Officer,Georgette,Chislett,gchislett2x@netvibes.com,Jawaharlal Nehru Technological University
Mann LLC,Quality Engineer,Slade,Elsmere,selsmere2y@bizjournals.com,Université d'Alger 3
"Wolff, Toy and Harber",VP Sales,Sholom,Riby,sriby2z@go.com,Universiti Malaysia Terengganu
Murphy Group,Financial Analyst,Angelo,Viall,aviall30@1688.com,Omsk State Agrarian University
West-Mueller,Assistant Professor,Darren,Barrim,dbarrim31@devhub.com,Marathwada Agricultural University
"Bauch, Roob and Haag",Web Designer IV,Ford,Marchelli,fmarchelli32@dell.com,Beijing Institute of Technology
Schinner and Sons,Budget/Accounting Analyst III,Frankie,Kield,fkield33@homestead.com,University of Guelph
Stehr-Parisian,Computer Systems Analyst II,Mercedes,Siret,msiret34@typepad.com,Central Agricultural University
Pouros-Cole,Geological Engineer,Elnar,Jozaitis,ejozaitis35@spiegel.de,Southern Ural State University
"Sanford, Brakus and Kemmer",Accountant IV,Genovera,Titchen,gtitchen36@reuters.com,State University of New York College at Oneonta
Bruen-Hodkiewicz,Statistician IV,Edwina,Aslum,easlum37@tuttocitta.it,Universidad de Especialidades del Espíritu Santo
Mante-Lueilwitz,Sales Representative,Natasha,Buten,nbuten38@imgur.com,Fachhochschule Merseburg
Kiehn-Morissette,Assistant Professor,Clarie,Pennock,cpennock39@oakley.com,Ueno Gakuen College
Mayert Group,Computer Systems Analyst IV,Wakefield,Zannetti,wzannetti3a@free.fr,Wake Forest University
"Roob, Hyatt and Quitzon",Systems Administrator III,Avrom,McLarty,amclarty3b@baidu.com,Ishinomaki Senshu University
Runolfsdottir-Rogahn,Paralegal,Davy,Seery,dseery3c@twitpic.com,Illinois College
Mayert Inc,Nurse Practicioner,Rasla,Malinson,rmalinson3d@walmart.com,National Changhua University of Education
Connelly LLC,Senior Editor,Pauline,Sheaber,psheaber3e@zimbio.com,International People's College
Sporer-Volkman,Product Engineer,Lisle,Haysar,lhaysar3f@ibm.com,Kyushu Institute of Technology
"Klein, Champlin and McClure",Database Administrator III,Shanna,Durrant,sdurrant3g@dion.ne.jp,Universidad Autónoma de Yucatán
Wolf-Becker,Administrative Officer,Nicolas,Lagden,nlagden3h@yelp.com,Miami Dade College
Purdy-Nikolaus,Systems Administrator II,Dory,Spadari,dspadari3i@studiopress.com,Maritime University in Szczecin
"Runte, Torp and Hermann",Software Consultant,Barbette,Stooke,bstooke3j@bluehost.com,Instituto Superior de Entre Douro e Vouga
"Sporer, Kling and Conroy",Recruiter,Verina,Chastan,vchastan3k@auda.org.au,Mandhu College
Hoeger-Wuckert,Software Engineer II,Marabel,Cobleigh,mcobleigh3l@theglobeandmail.com,Kent State University
"Gerlach, Windler and Kuvalis",Senior Cost Accountant,Zahara,Pimlett,zpimlett3m@wix.com,Technological Education Institute of Kalamata
"Price, Wisoky and Abernathy",Senior Financial Analyst,Sibylle,Schooley,sschooley3n@xing.com,Academy of Humanities and Economics in Lodz
"Daugherty, Wehner and Kirlin",Budget/Accounting Analyst IV,Jemmy,Domegan,jdomegan3o@histats.com,Svey Reong University
Hyatt-Goodwin,Human Resources Assistant II,Jethro,Prott,jprott3p@cnbc.com,Shaheed Beheshti University
Block-Huels,Statistician IV,Agatha,Thorlby,athorlby3q@altervista.org,International Centre for Isclamic Science
Reichert-Koss,Dental Hygienist,Marcello,Olivi,molivi3r@forbes.com,University of Wisconsin - Parkside
"Hickle, Effertz and Purdy",Nuclear Power Engineer,Tybi,Crowcroft,tcrowcroft3s@upenn.edu,Université Ibn Zohr Agadir
Conroy Group,Community Outreach Specialist,Duffy,Zoephel,dzoephel3t@about.me,Hasselt University
Witting-Schowalter,Librarian,Reine,Hearmon,rhearmon3u@soundcloud.com,Tokyo Women's College of Physical Education
Hyatt-Larkin,VP Marketing,Morly,Fahrenbach,mfahrenbach3v@mac.com,University of Economics in Bratislava
Zboncak LLC,Analyst Programmer,Jandy,Culmer,jculmer3w@apple.com,Otto-Friedrich Universität Bamberg
"Graham, Feeney and Lowe",Engineer III,Doreen,Mouatt,dmouatt3x@eepurl.com,American University of Armenia
"Gerlach, Ryan and Kuhlman",Analog Circuit Design manager,Ozzie,Phayre,ophayre3y@technorati.com,Institut Prima Bestari - Pine Academy 
Gleason-Larkin,Analog Circuit Design manager,Ronda,Hadlee,rhadlee3z@jigsy.com,Kumamoto Institute of Technology
Walker Group,Electrical Engineer,Armando,Rime,arime40@wikipedia.org,Hankuk Aviation University
Mitchell-Boyer,Web Designer III,Junina,Jowers,jjowers41@pcworld.com,Albert-Ludwigs-Universität Freiburg
"Rice, Shanahan and Dicki",Sales Associate,Roanna,Charle,rcharle42@constantcontact.com,"Evangelische Theologische Faculteit, Leuven"
King-Kertzmann,Automation Specialist II,Neysa,Pinnell,npinnell43@tinyurl.com,Universitas Muhammadiyah Makassar
Jast-Mills,Developer I,Milli,Holborn,mholborn44@instagram.com,Universidad Juárez del Estado de Durango
Beier Group,Design Engineer,Claire,Blakden,cblakden45@yolasite.com,Chu Hai College
Johns-Bogan,Staff Scientist,Ephrem,Nichol,enichol46@mediafire.com,Université de Batna
Denesik-Grady,Web Developer II,Eadmund,O'Downe,eodowne47@naver.com,SRM Institute Of Science & Technology ( Deemed University)
Hauck LLC,Structural Analysis Engineer,Renato,Rowledge,rrowledge48@51.la,Hochschule Magdeburg-Stendal (FH)
Muller and Sons,Director of Sales,Xymenes,Jacomb,xjacomb49@mail.ru,George Brown College
Kunze-Nicolas,Civil Engineer,Davita,Jaeggi,djaeggi4a@ox.ac.uk,University of the Philippines Visayas
"Powlowski, Dare and Klein",Librarian,Roth,Kausche,rkausche4b@icq.com,Huanghe Science & Technology University
Collier LLC,Quality Engineer,Sophi,Couthard,scouthard4c@xrea.com,University of Montana
Rolfson Group,Electrical Engineer,Devonne,Lowdwell,dlowdwell4d@domainmarket.com,Ecole Nationale d'Ingénieurs des Techniques des Industries Agricoles et Alimentaires
Zboncak-Wehner,Senior Developer,Roy,Martensen,rmartensen4e@comsenz.com,Qassim University
Prohaska and Sons,Administrative Assistant III,Quent,MacGettigen,qmacgettigen4f@vk.com,Luther College
Grimes LLC,Environmental Specialist,Trevor,Sallarie,tsallarie4g@angelfire.com,University of Oklahoma
"Cartwright, Corkery and Jerde",Help Desk Operator,Steven,Orr,sorr4h@hostgator.com,Warren Wilson College
"Cartwright, Kling and Casper",VP Quality Control,Glynnis,Dashper,gdashper4i@va.gov,Instituto Tecnologico de Minatitlan
"Gottlieb, Krajcik and Kub",Executive Secretary,Rosella,Berge,rberge4j@nba.com,Guangxi Medical University
"Okuneva, Johns and Altenwerth",VP Accounting,Kerry,Wesson,kwesson4k@newsvine.com,Texas A&M University - Corpus Christi
Becker-Fahey,Editor,Spenser,Watsham,swatsham4l@photobucket.com,Lesley University
Huel-Champlin,Quality Control Specialist,Emily,Wyleman,ewyleman4m@ning.com,University of Southern California
White and Sons,Assistant Manager,Robby,Alwin,ralwin4n@technorati.com,Hatyai University
"Gibson, Kovacek and Prohaska",General Manager,Cindie,Polini,cpolini4o@a8.net,Universidad de Valencia
"Denesik, Hessel and Macejkovic",Budget/Accounting Analyst I,Ricky,Duchasteau,rduchasteau4p@pinterest.com,Université Protestante au Congo
"Mosciski, Larson and Stokes",Staff Scientist,Linnell,Edmenson,ledmenson4q@hexun.com, Dedan Kimathi University of Technology
Kessler Inc,Speech Pathologist,Ignatius,Dartnall,idartnall4r@last.fm,Private FernFachhochschule Darmstadt
Lesch and Sons,Geological Engineer,Cortie,Joire,cjoire4s@xing.com,Chiba University
"Hickle, Eichmann and Mills",Junior Executive,Anatola,Tabbernor,atabbernor4t@tinyurl.com,Academy of Arts in Banská Bystrica
"Williamson, Johns and Legros",Safety Technician III,Eve,Aldin,ealdin4u@google.fr,Brock University
Hintz and Sons,Marketing Manager,Raul,Traynor,rtraynor4v@dropbox.com,Universidad del Tolima
"Labadie, Ankunding and Thiel",Geological Engineer,Yancy,Easseby,yeasseby4w@telegraph.co.uk,Niigata University of International and Information Studies
Funk and Sons,Web Designer I,Etta,Warnes,ewarnes4x@1und1.de,Arcadia University
Jacobson LLC,Nuclear Power Engineer,Frederich,O'Hederscoll,fohederscoll4y@youtube.com,Moscow State University of Forestry Engineering
Lynch-Glover,Quality Engineer,Jolyn,Grisewood,jgrisewood4z@instagram.com,Silliman University
Torp Group,Assistant Manager,Norry,Pendreigh,npendreigh50@youtube.com, Université de Nouakchott
Toy-Welch,Junior Executive,Kippie,Klos,kklos51@last.fm,"International Islamic University, Islamabad"
"Johnston, Kilback and Ebert",Physical Therapy Assistant,Peri,Rounce,prounce52@nature.com,Franklin College Switzerland
"Quitzon, Nienow and Towne",Programmer I,Deni,Jukubczak,djukubczak53@redcross.org,Baker College of Owosso
Goyette-Kuvalis,Recruiter,Adelina,Doleman,adoleman54@de.vu,Silver Lake College
Mann Inc,Safety Technician II,Gwendolen,Goldie,ggoldie55@paypal.com,"Islamic Azad University, Central Tehran Branch"
Hamill LLC,Editor,Vicky,Oakley,voakley56@blogtalkradio.com,"Dai Ichi University, College of Technology"
Gerhold Inc,Clinical Specialist,Cayla,Shaxby,cshaxby57@jigsy.com,Universität der Bundeswehr München
"Kiehn, Brown and Connelly",Chief Design Engineer,Dex,Castagna,dcastagna58@netlog.com,Trevecca Nazarene University
Hartmann-Lockman,Safety Technician II,Dunc,Lade,dlade59@webs.com,Universidad de La Amazonia
Bayer-Gutmann,Systems Administrator I,Guy,Briers,gbriers5a@163.com,Catawba College
Murphy and Sons,Sales Representative,Reynolds,Absolon,rabsolon5b@cbc.ca,Chandra Shekhar Azad University of Agriculture and Technology
Prohaska-Bayer,Senior Quality Engineer,Tyson,Zelland,tzelland5c@yahoo.co.jp,Danish University of Education
Smitham-Frami,Research Nurse,Brigit,Vowden,bvowden5d@fotki.com,Belmont University
"Schimmel, Leffler and Bednar",Database Administrator IV,Archer,Blowfield,ablowfield5e@nps.gov,Baylor College of Medicine
Gerlach Inc,Administrative Officer,Eula,Karchewski,ekarchewski5f@google.com.hk,Hotelschool The Hague
"Will, Sipes and Block",Developer III,Esra,Towns,etowns5g@mysql.com,Ecole Centrale de Nantes
Rogahn-Nitzsche,Senior Editor,Merralee,Gartshore,mgartshore5h@yolasite.com,Vietnam National University Hanoi
Shanahan LLC,Financial Analyst,Ringo,I'anson,rianson5i@paginegialle.it,Military Institute of Science and Technology
Jaskolski-Casper,Financial Advisor,Tabbie,Raoult,traoult5j@networksolutions.com,Universitas Trilogi
Goodwin-Gorczany,Assistant Professor,Teodoro,Gabites,tgabites5k@jimdo.com,Preston Institute of Management Sciences and Technology (PIMSAT)
Kling and Sons,Account Representative III,Cyrill,Massen,cmassen5l@jiathis.com,Kingston College
"Runte, Toy and Waelchi",Nurse Practicioner,Iosep,Binden,ibinden5m@about.com,Moldova State Agricultural University
Herzog-Parisian,Chief Design Engineer,Ailene,Godbald,agodbald5n@globo.com,Tabriz University of Medical Sciences
Ruecker-VonRueden,Civil Engineer,Ryun,Coupman,rcoupman5o@miibeian.gov.cn,Alahgaff University
Lind-Koelpin,Analyst Programmer,Herculie,Vernay,hvernay5p@sbwire.com,"Fachhochschule Pforzheim, Hochschule für Gestaltung, Technik und Wirtschaft"
Fahey Inc,Programmer III,Grata,Spreull,gspreull5q@cbc.ca,Dalian Medical University
"Hettinger, Koch and Cole",Payment Adjustment Coordinator,Jere,Lovel,jlovel5r@deviantart.com,Instituto Superior de Paços de Brandão
Hessel LLC,Staff Scientist,Charley,Kearns,ckearns5s@addthis.com,Blue Mountains Hotel School
Kertzmann-Hettinger,Administrative Assistant III,Annabel,Howchin,ahowchin5t@adobe.com,Tver State Technical University
"Walker, Harvey and Heaney",Cost Accountant,Lenka,Beckham,lbeckham5u@weather.com,University of the District of Columbia
Stracke Group,Web Developer II,Meghan,Destouche,mdestouche5v@php.net,Adama Science and Technology University
"Kris, Beatty and Hartmann",Electrical Engineer,Stephana,Pidgin,spidgin5w@arizona.edu,Universidad de Alicante
"Turcotte, Kuhic and Wyman",Food Chemist,Anthea,Wythill,awythill5x@unicef.org,Johann Wolfgang Goethe Universität Frankfurt am Main
"Kilback, McKenzie and Schamberger",Information Systems Manager,Anabel,Micco,amicco5y@biblegateway.com,Daneshestan Institute of Higher Education
Hoppe-Kulas,Sales Representative,Yance,Bester,ybester5z@opensource.org,Dr. Babasaheb Ambedkar Marathwada Universtiy
Bergnaum-Nolan,Web Developer IV,Zonda,Greenroa,zgreenroa60@wired.com,United States Merchant Marine Academy
Ebert Inc,Assistant Manager,Weber,Doog,wdoog61@google.nl,Buraydah College for Applied Medical Sciences
"Kirlin, Okuneva and Gleichner",Senior Quality Engineer,Carroll,Janatka,cjanatka62@people.com.cn,University of Technology
Jerde Inc,Human Resources Manager,Thor,Sivior,tsivior63@forbes.com,Winston-Salem State University
"Watsica, Brakus and Swift",Biostatistician II,Walt,Moral,wmoral64@zdnet.com,Gifu Pharmaceutical University
Shields-Murray,Developer I,Cortney,Ponten,cponten65@pinterest.com,Johann Wolfgang Goethe Universität Frankfurt am Main
"O'Reilly, Crooks and Rempel",Physical Therapy Assistant,Laetitia,Oselton,loselton66@php.net,Université Catholique de Kabgayi
Schaden Group,Senior Cost Accountant,Cristian,McCulley,cmcculley67@diigo.com,North Kazakhstan State University
Wyman Group,Senior Developer,Letitia,Cramer,lcramer68@army.mil,Odessa National Maritime Academy
Hauck and Sons,Executive Secretary,Frasquito,Mullally,fmullally69@paginegialle.it,"École nationale d'administration publique, Université du Québec"
Barton-Turcotte,Analyst Programmer,Oswell,Curgenuer,ocurgenuer6a@guardian.co.uk,University of Calicut
"Oberbrunner, Mertz and Schumm",Accounting Assistant II,Merilyn,Broose,mbroose6b@myspace.com,Scandinavian Art and Business Institute
Halvorson Group,Chief Design Engineer,Freddie,Dybbe,fdybbe6c@yelp.com,Sri Lanka Institute of Advanced Technical Education
"Bechtelar, Schiller and Upton",Recruiter,Colette,Coulman,ccoulman6d@ca.gov,Instituto de Enseñanza Superior Oteima
"Harber, Towne and Tillman",Research Associate,Nickey,Braysher,nbraysher6e@nps.gov,Jichi Medical School
Schamberger Inc,Senior Cost Accountant,Arlen,Fairest,afairest6f@un.org,Utkal University
Kuphal Group,Pharmacist,Jordon,Spargo,jspargo6g@imageshack.us,College Misericordia
Spinka and Sons,Chemical Engineer,Kristos,Stubbes,kstubbes6h@toplist.cz,State University of New York at Albany
Howell and Sons,Cost Accountant,Corrinne,Brendish,cbrendish6i@goo.ne.jp,Dalarna University College
"Roob, Heidenreich and Von",Speech Pathologist,Karole,Meharry,kmeharry6j@hostgator.com,Northwestern University In Qatar
"Schiller, Emmerich and Kiehn",Help Desk Operator,Gisella,Blakeslee,gblakeslee6k@house.gov,Universitas HKBP Nommensen
Wilkinson-Miller,Budget/Accounting Analyst IV,Tildy,Siviour,tsiviour6l@ucsd.edu,Tokyo International University
"Connelly, Bartell and Bauch",Developer III,Ddene,Bearward,dbearward6m@fotki.com,Gemsville Technical University
Reinger Inc,Financial Advisor,Jorie,Pechold,,"Davenport College of Business, Grand Rapids"
