CURRENT COMPANY,JOB TITLE,FIRST NAME,LAST NAME,EMAIL,UNIVERSITY
Kuvalis-Mosciski,Software Test Engineer III,Hillel,Sabate,hsabatek3@businesswire.com,College of St. Joseph
Schimmel and Sons,Actuary,Erena,Stubbington,estubbingtonk4@ocn.ne.jp,Christ University
"Cremin, Heller and Ritchie",VP Quality Control,Freddie,Treby,ftrebyk5@answers.com,Eurasian Institute of market
"Price, Lubowitz and Schiller",Physical Therapy Assistant,Adeline,Kynder,akynderk6@dmoz.org,Hahnamann Honoeopathic Medical College
"Kilback, Ondricka and Oberbrunner",Statistician III,Flem,Thurlby,fthurlbyk7@who.int,University of Pavia
Ryan-Corwin,Teacher,Theo,Loveday,tlovedayk8@indiegogo.com,Ama International University
"Block, Stokes and Bashirian",Safety Technician I,Berkeley,Vasilmanov,bvasilmanovk9@geocities.com,Jilin University of Technology
"Hilll, Graham and Stamm",Account Coordinator,Ema,Wildes,ewildeska@google.fr,International University of Sarajevo
Breitenberg LLC,Compensation Analyst,Kiri,Jurgen,kjurgenkb@parallels.com,Université de la Polynésie Française
McGlynn Inc,Research Nurse,Hube,Van Dijk,hvandijkkc@typepad.com,Amity University
"Cole, Langworth and Hintz",Human Resources Manager,Andriana,Prynne,aprynnekd@uol.com.br,St. Joseph University Beirut
Wilderman Inc,Payment Adjustment Coordinator,Rebe,Yarnton,ryarntonke@dion.ne.jp,University of Nijenrode
Johns-Shields,Quality Engineer,Lorene,Ambrosi,lambrosikf@amazon.com,Excelsior College
"Bahringer, Kuphal and Glover",Actuary,Kimbra,Ebbin,kebbinkg@bbc.co.uk,Tbilisi State University
Borer LLC,VP Sales,Zebadiah,Raubheim,zraubheimkh@cam.ac.uk,South Eastern Kenya University
Simonis Group,Accounting Assistant I,Arliene,Hackleton,ahackletonki@ovh.net,Ecole Nationale de la Statistique et de l'Administration Economique
Boyle-Huels,Assistant Professor,Jeni,Nairns,jnairnskj@yale.edu,Tongji University
"Wiegand, Hammes and Champlin",Project Manager,Rabbi,Gemeau,rgemeaukk@creativecommons.org,"University of the West of England, Bristol"
Collier-Dibbert,Database Administrator II,Shandee,Amott,samottkl@devhub.com,Massey University
Witting-Beahan,Engineer I,Stacey,McNelly,smcnellykm@php.net,University of North West
"Legros, Reilly and Pagac",Pharmacist,Winona,Poulston,,North South University
Lubowitz Group,Payment Adjustment Coordinator,Sanson,De Cruce,sdecruceko@illinois.edu,Florida Memorial College
"Walter, Ullrich and Turcotte",Statistician I,Denyse,Farncomb,dfarncombkp@dagondesign.com,Shanghai Television University
"Turcotte, Klocko and Grady",Health Coach I,Nerta,Carabine,ncarabinekq@domainmarket.com,Universidad Politécnica de Cataluna
Feest LLC,Help Desk Operator,Chester,Maffeo,cmaffeokr@census.gov,Ryerson Polytechnic University
"Wuckert, Bauch and Corkery",Assistant Media Planner,Lucine,Fiveash,lfiveashks@freewebs.com,Trent University
"Nolan, Pfannerstill and Boehm",General Manager,Daffie,Headey,dheadeykt@vistaprint.com,Tomsk Polytechnic University
"Ebert, Spencer and Keebler",Mechanical Systems Engineer,Caressa,Gash,cgashku@engadget.com,Spartan University of Health Sciences
Morar and Sons,Administrative Assistant IV,Angela,Clapham,,Dalian University of Technology
"Dare, Orn and West",Software Engineer IV,Charissa,Mighele,cmighelekw@prnewswire.com,Medizinische Hochschule Hannover
Cremin-Stamm,Structural Engineer,Brennen,Grimbleby,,Ohio State University - Marion
"Okuneva, Schimmel and Kilback",Account Representative III,Patrizio,Stickells,pstickellsky@youtu.be,Miami University of Ohio - Hamilton
"Franecki, McKenzie and Schaefer",Environmental Specialist,Dion,Odgaard,dodgaardkz@irs.gov,University of Modern Sciences
Ledner-Blick,Programmer IV,Kessiah,Crooks,kcrooksl0@buzzfeed.com,Spiru Haret University
Wolf Group,Sales Representative,Brendis,Bartolomeotti,bbartolomeottil1@state.tx.us,St. Petersburg State University of Telecommunication
Bernier-Blanda,Actuary,Lavena,Leneham,llenehaml2@studiopress.com,Lawrence University
"Purdy, Schroeder and Dach",Staff Accountant II,Alvis,Winton,awintonl3@businesswire.com,Hawler Medical University
"Boehm, Lynch and Ondricka",Desktop Support Technician,Sanderson,McKinnell,smckinnelll4@hibu.com,Universidad Nacional de Tucumán
Reichel-Bechtelar,Information Systems Manager,Johnath,Janczewski,jjanczewskil5@washington.edu,William Carey College
Kohler LLC,Software Consultant,Wally,Halpeine,whalpeinel6@howstuffworks.com,Ecole Catholique d'Arts & Metiers
"Quitzon, Paucek and Schuster",Chief Design Engineer,Mariska,Vines,mvinesl7@typepad.com,Semnan University of Medical Sciences
Ryan-Weissnat,Junior Executive,Porty,Sheircliffe,psheircliffel8@uiuc.edu,Saurashtra University
Heaney and Sons,Senior Cost Accountant,Nichols,Matsell,nmatselll9@umn.edu,Universitat Rámon Llull
Ankunding-Koelpin,Computer Systems Analyst IV,Auberta,Dekeyser,adekeyserla@bluehost.com,Hochschule Albstadt-Sigmaringen
"Rohan, O'Keefe and Morissette",VP Product Management,Yule,Vedyasov,yvedyasovlb@typepad.com,Universidad Autónoma de Nayarit
"Wintheiser, Koepp and Feeney",Internal Auditor,Tobias,Le Gassick,tlegassicklc@uiuc.edu,Queensland University of Technology
Huel-Wuckert,Research Nurse,Fredrika,Driver,fdriverld@e-recht24.de,Busitema University
Bayer-Wehner,Registered Nurse,Bealle,Ivanchov,bivanchovle@usda.gov,Lansbridge University
"Mayer, Kreiger and Kutch",Help Desk Operator,Gorden,Furzey,gfurzeylf@elegantthemes.com,Yunnan University
Daniel and Sons,Legal Assistant,Joshia,Seth,jsethlg@taobao.com,Ryerson Polytechnic University
Hane-Kuhlman,Accountant II,Aileen,Milsted,amilstedlh@sohu.com,Eichi University
Rowe-Little,Associate Professor,Lou,Cripin,lcripinli@istockphoto.com,Centro Universitario Villanueva
Labadie and Sons,Database Administrator IV,Marco,Cowern,mcowernlj@cargocollective.com,Universitas Siliwangi
Cassin-Runolfsson,Product Engineer,Edmon,Morad,emoradlk@dagondesign.com,Universitas Lampung
Welch-Carter,VP Accounting,Gael,Coggeshall,gcoggeshallll@answers.com,Mesa State College
"Hirthe, Heaney and Hilll",Quality Engineer,Bancroft,MacCracken,bmaccrackenlm@indiegogo.com,University of Guyana
"Lockman, Vandervort and Aufderhar",Tax Accountant,Alfie,Tschierasche,atschierascheln@usa.gov,Universidad de Occidente
"Predovic, Littel and Sawayn",Health Coach III,Gabrila,Readhead,greadheadlo@slideshare.net,"South-West University ""Neofit Rilski"""
Emmerich-Dooley,Civil Engineer,Micheil,Dericot,mdericotlp@squidoo.com,Chandra Shekhar Azad University of Agriculture and Technology
Waters-Schaden,Paralegal,Bernie,Bannester,bbannesterlq@sciencedaily.com,Universidade Autónoma de Lisboa Luís de Camoes
Ankunding Inc,Chemical Engineer,Whitby,Halwood,whalwoodlr@uiuc.edu,"Fachhochschule Schwäbisch Gmünd, Hochschule für Gestaltung"
Lebsack LLC,Account Executive,Stanleigh,Gage,sgagels@howstuffworks.com,Virginia Union University
Veum-Buckridge,Research Assistant IV,Sande,Pellamont,spellamontlt@geocities.com,Institut Catholique de Toulouse
Frami-Dibbert,VP Accounting,Frank,Weld,fweldlu@craigslist.org,Karpagam University
Gislason and Sons,Computer Systems Analyst III,Tessie,Melrose,tmelroselv@prweb.com,Universidad Regional del Sureste
"Feeney, Walker and Mann",Sales Associate,Will,Wisker,wwiskerlw@mac.com,Universitas Sultan Ageng Tirtayasa
Hane Inc,Speech Pathologist,Jackie,Shermore,jshermorelx@dmoz.org,Mongolian National University
Leuschke Group,Food Chemist,Belva,Syms,bsymsly@cocolog-nifty.com,Universiti Teknologi Mara
Steuber Group,Chemical Engineer,Merrile,De Gregorio,mdegregoriolz@foxnews.com,Universidad de Sonsonate
Volkman-Glover,Automation Specialist I,Margot,Filipczak,mfilipczakm0@hp.com,Western Baptist College
"Runte, Jast and Wiegand",VP Product Management,Zulema,Mauger,zmaugerm1@hibu.com,University of Kalyani
"Mertz, Schamberger and Ledner",Developer I,Kandace,Molder,kmolderm2@naver.com,French University in Armenia (UFAR)
"Gottlieb, Kunde and Grimes",Quality Engineer,Allianora,Terrett,aterrettm3@reddit.com,University of Waterloo
Mann Group,Budget/Accounting Analyst III,Tomlin,Cochran,tcochranm4@php.net,Sripatum University
Lockman LLC,Senior Financial Analyst,Demott,Bothie,dbothiem5@oakley.com,Bells University of Technology
"Herzog, Gaylord and Reilly",Help Desk Technician,Tod,Clowton,tclowtonm6@acquirethisname.com,Universidad Rural de Guatemala
"Sanford, Kub and Larkin",Software Engineer III,Rhodia,Oakey,roakeym7@hc360.com,Huaihua Medical College
"Roob, Hansen and Windler",Nurse,Sayers,Seden,ssedenm8@ehow.com,"University of Maine, Fort Kent"
Runte and Sons,Actuary,Bel,Kimmons,bkimmonsm9@google.ca,Toyo University
Carter-McKenzie,Physical Therapy Assistant,Aggy,Plews,aplewsma@senate.gov,Vitebsk State Medical University
Walter-Klein,Web Designer III,Jackquelin,Ranyell,jranyellmb@opera.com,Dixie College
Ritchie Inc,Structural Engineer,Clemmie,Kingcott,ckingcottmc@opera.com,Hong Kong University of Science and Technology
Williamson and Sons,Nurse,Abbie,Scarisbrick,ascarisbrickmd@ted.com,Selcuk University
"Gerhold, Lubowitz and Larkin",Speech Pathologist,Ardisj,Elfitt,aelfittme@unblog.fr,University of Vaasa
Lueilwitz and Sons,Developer I,Alec,Phillott,aphillottmf@weather.com,Atyrau State University
Fahey-Kihn,VP Product Management,Wandie,Gommowe,wgommowemg@sohu.com,October 6 university
Krajcik Group,Account Representative III,Davey,Baly,dbalymh@blinklist.com, Technological University (Yangon)
Osinski LLC,Statistician II,Annemarie,Wilmot,awilmotmi@mashable.com,Delft University of Technology
Kautzer LLC,Occupational Therapist,Alyss,Iverson,aiversonmj@vk.com,Novosibirsk State Agricultural University
Tromp-Graham,Electrical Engineer,Augustus,Dregan,adreganmk@issuu.com,Daystar University
"Jacobs, VonRueden and Batz",Editor,Jonie,Stroobant,jstroobantml@twitpic.com,Universidad Centroamericana de Ciencias Empresariales (UCEM)
Daniel-Rodriguez,Assistant Media Planner,Shoshanna,Hogsden,shogsdenmm@thetimes.co.uk,Les Roches International School of Hotel Management
Larkin and Sons,Marketing Assistant,Cad,Grzegorzewski,cgrzegorzewskimn@businessweek.com,Moscow State University of Forestry Engineering
"Borer, Nolan and Torphy",Marketing Assistant,Darby,Stolting,dstoltingmo@sun.com,Universidad de Lambayeque
O'Hara-Rogahn,VP Marketing,Othello,Perch,operchmp@google.cn,Instituto Politécnico de Leiria
Legros-Swaniawski,Nuclear Power Engineer,Janella,Pineaux,jpineauxmq@hao123.com,Universiti Sultan Zainal Abidin
"Tremblay, Aufderhar and D'Amore",Programmer I,Brennan,Towey,btoweymr@gmpg.org,Postgraduate Institute of Agriculture (PGIA)
Lemke Group,Registered Nurse,Karoly,Wanka,kwankams@whitehouse.gov,University of Ontario Institute of Technology
Boehm LLC,Staff Scientist,Aili,Metrick,ametrickmt@skyrock.com,Jönköping University College of Health Sciences
"Feest, Becker and Rogahn",Geologist I,Ivar,De Mico,idemicomu@1688.com,Hoshi University
Zemlak LLC,Technical Writer,Shawn,Chaundy,schaundymv@lycos.com,Université de Nantes
"Terry, Ebert and Murphy",Senior Cost Accountant,Phyllis,Plank,,Novosibirsk State Technical University
"Conn, Kerluke and Leffler",Geological Engineer,Madelena,Wickersley,mwickersleymx@fastcompany.com,Angeles University
Swift Inc,Human Resources Assistant I,Pammie,Amer,pamermy@slate.com,National University of Computer & Emerging Sciences
Kohler Group,Pharmacist,Rab,Giuron,rgiuronmz@addtoany.com,Universidad Rafael Urdaneta
Fahey-Treutel,Community Outreach Specialist,Devi,Marlon,,Kanagawa University
Lockman Inc,Administrative Officer,Ketti,Piller,kpillern1@goodreads.com,Southwestern Oklahoma State University
Marvin-Greenfelder,Nuclear Power Engineer,Aldous,McKoy,amckoyn2@businessinsider.com,Tashkent University of Information Technologies
Cormier Group,Programmer Analyst I,Del,Fipp,dfippn3@liveinternet.ru,University of Minnesota - Duluth
"Terry, Kunze and Beier",Account Executive,Hal,Doyle,hdoylen4@hc360.com,"California State University, Northridge"
Pouros-Denesik,Senior Developer,Cate,Onraet,conraetn5@yahoo.com,Aichi Institute of Technology
Botsford-Toy,Dental Hygienist,Hoyt,Derbyshire,hderbyshiren6@nydailynews.com,Universidad del Mayab
Fay-Wintheiser,Research Nurse,Christel,Hasser,chassern7@ow.ly,Sadat Institute of Higher Education
Legros LLC,Financial Advisor,Joye,Coughtrey,jcoughtreyn8@example.com,University of Plovdiv
Breitenberg Inc,VP Sales,Garnette,Weepers,gweepersn9@mediafire.com,Mozyr State Pedagogical Institute
Simonis-Fay,VP Sales,Aurilia,Ganiford,aganifordna@usa.gov,NED University of Engineering and Technology Karachi
Wolff Inc,Structural Analysis Engineer,Emmaline,Rabier,erabiernb@seattletimes.com,Oklahoma State University Center for Health Sciences
Feest and Sons,Research Nurse,Lorelei,Wytchard,lwytchardnc@people.com.cn,Kyoto City University of Arts
"Mills, Kling and Bayer",Research Associate,Gerhard,Glynne,gglynnend@smh.com.au,North South University
Farrell-Gleichner,Research Nurse,Elwyn,Yeardley,eyeardleyne@tripadvisor.com,Charleston Southern University
"Stamm, Turcotte and Rogahn",Design Engineer,Freddy,Futcher,ffutchernf@newsvine.com,Dutch Delta University
Keeling and Sons,Database Administrator I,Salomone,Waby,swabyng@unesco.org,University of Aleppo
Smitham-Barrows,VP Accounting,Cesya,Springall,cspringallnh@tumblr.com,College of Technology at Jeddah
Klein and Sons,Quality Engineer,Iosep,Wethers,iwethersni@sitemeter.com,Universidade Estadual do Ceará
Zieme and Sons,Legal Assistant,Ray,Malster,rmalsternj@dot.gov,Universidade Católica de Moçambique
"Kessler, Abbott and Greenholt",Cost Accountant,Herculie,Solway,hsolwaynk@samsung.com,Universidad del Desarrollo
"MacGyver, Borer and Kreiger",Web Designer IV,Ruperto,Daddow,rdaddownl@google.ca,Etisalat University College
Moore-Hartmann,Business Systems Development Analyst,Wren,ducarme,,Franciscan School of Theology
O'Reilly-Kerluke,VP Marketing,Rorke,Tassel,rtasselnn@auda.org.au,Colorado College
Koss LLC,Budget/Accounting Analyst I,Dal,Filler,dfillerno@123-reg.co.uk,Silesian Academy of Medicine in Katowice
Thiel-Thiel,Actuary,Stavros,Keig,skeignp@paginegialle.it,Franklin Pierce Law Center
"Nienow, Crooks and Fisher",Quality Engineer,Margaretta,Ough,moughnq@cbslocal.com,Universiti Malaysia Sarawak
"Bradtke, Swift and Roberts",Occupational Therapist,Garret,Spaven,gspavennr@weather.com,Saudi Electronic University
Rosenbaum-Kuhic,Senior Sales Associate,Shaina,Cheesley,scheesleyns@angelfire.com,Houston Baptist University
Reynolds LLC,Analog Circuit Design manager,Ilka,Edworthy,iedworthynt@sbwire.com,"Universidad Tecnológica del Choco ""Diego Luis Cordoba"""
Bruen-King,Human Resources Assistant III,Flor,Myrkus,fmyrkusnu@paginegialle.it,Universidad Estatal a Distancia
Grady and Sons,Operator,Wes,Hastelow,whastelownv@google.fr,Ecole Nationale Supérieure des Mines d'Alès
"Langosh, Schulist and Sawayn",Design Engineer,Gayleen,Laminman,glaminmannw@senate.gov,Xi'an University of Technology
Schulist-Hills,Occupational Therapist,Crissie,Ginie,cginienx@photobucket.com,Nairobi Institute of Business Studies 
Tillman Group,Sales Associate,Vickie,Paradyce,vparadyceny@theglobeandmail.com,College of Notre Dame
Kihn-Lynch,Database Administrator I,Lem,Ashpole,lashpolenz@wikipedia.org,Universidad del Valle de Atemajac
Nitzsche Group,VP Sales,Pieter,Boultwood,pboultwoodo0@merriam-webster.com,Takhar University
Williamson-Gleichner,Legal Assistant,Sigfried,Mauchlen,smauchleno1@squarespace.com,Guangzhou Normal University
Bergstrom LLC,Research Associate,Clayborn,Steart,cstearto2@usnews.com,Houston Baptist University
Kshlerin Inc,Design Engineer,Caro,Speares,cspeareso3@taobao.com,Mount Allison University
Nolan LLC,Assistant Media Planner,Twila,McEvilly,tmcevillyo4@indiegogo.com,Kennesaw State University
"Block, Sauer and Conn",Web Designer IV,Lorraine,Just,ljusto5@angelfire.com,Danish University of Education
"Corwin, Lockman and Reinger",Office Assistant IV,Enos,Borth,ebortho6@e-recht24.de,Nottingham Trent University
Mueller LLC,Assistant Professor,Leora,Unger,lungero7@bloomberg.com,Kyoto City University of Arts
Dibbert Group,Analyst Programmer,Myranda,Cullivan,mcullivano8@twitpic.com,Fred Hutchinson Cancer Research Center
Cremin-Lehner,Help Desk Operator,Mandel,Rowlson,mrowlsono9@dailymotion.com,SRM Institute Of Science & Technology ( Deemed University)
"Conroy, Wolf and Lind",Assistant Manager,Shaylah,Marzele,smarzeleoa@economist.com,Université du Droit et de la Sante (Lille II)
"O'Connell, Gerhold and Swaniawski",Sales Representative,Reed,Guerrero,rguerreroob@sphinn.com,University of Central Missouri
"Bashirian, Marvin and Hegmann",Human Resources Manager,Bartholemy,Patrick,bpatrickoc@wikispaces.com,Kaohsiung Medical College
Haley Inc,Safety Technician II,Brewer,Risso,brissood@elegantthemes.com,Assosa University
"Morar, Mann and Windler",Sales Associate,Maggie,Mould,mmouldoe@fotki.com,United States International University
Gottlieb LLC,VP Product Management,Leticia,De Ferraris,ldeferrarisof@addtoany.com,Hartford Graduate Center (Rensselaer at Hartford)
Flatley-Hackett,Assistant Professor,Pennie,Charker,pcharkerog@omniture.com,Birmingham-Southern College
"Bosco, Stroman and Marvin",Technical Writer,Marcy,Peal,mpealoh@marketwatch.com,Bangladesh University of Textiles
Deckow Group,Sales Associate,Nata,Rosencrantz,nrosencrantzoi@virginia.edu,St. Augustine International University
"Friesen, Reynolds and Heidenreich",Junior Executive,Lyle,Jacquemard,ljacquemardoj@hibu.com,Belarussian State Agrarian Technical University
Kiehn-Kovacek,Senior Editor,Ambrose,Ballsdon,aballsdonok@nyu.edu,University of Messina
Smitham Inc,General Manager,Tamera,Schaffel,tschaffelol@kickstarter.com,Russian Academy of Theatre Arts
Schulist and Sons,Civil Engineer,Ilysa,Mattschas,imattschasom@marriott.com,Westminster College Fulton
"Lemke, Robel and Upton",VP Sales,Hillel,Hughes,hhugheson@springer.com,Virginia Union University
Crooks-Kerluke,Design Engineer,Felicio,Kalinowsky,fkalinowskyoo@trellian.com,Surgut State University
Frami LLC,Internal Auditor,Karla,Nipper,knipperop@uol.com.br,University of Memphis
Renner-Willms,Tax Accountant,Herman,Knatt,hknattoq@microsoft.com,Rizal Technological University
Effertz LLC,Design Engineer,Danya,Ragdale,dragdaleor@vkontakte.ru,Blekinge Institute of Technology
Denesik Inc,Editor,Iseabal,Waldron,iwaldronos@unblog.fr,Berklee College of Music
Krajcik LLC,Registered Nurse,Aila,Beaney,abeaneyot@geocities.com,Covenant College
Leuschke Inc,Product Engineer,Abel,Griss,agrissou@ycombinator.com,University College of Cape Breton
Cartwright and Sons,Physical Therapy Assistant,Elene,Jobey,,Roosevelt Academy University College
"Hauck, Toy and Parker",Staff Scientist,Wood,Writer,wwriterow@nba.com,Iqra University
Kreiger Group,Web Designer I,Nicol,Songhurst,,Universidad de Cartago Florencio del Castillo
Waters-Frami,Pharmacist,Daune,Upfold,,MCI-Management Center Innsbruck
"Hirthe, Leannon and Larkin",Systems Administrator IV,Dyna,McCarlich,dmccarlichoz@alibaba.com,Hamamatsu University School of Medicine
"Bernhard, D'Amore and Hermiston",Health Coach III,Hadrian,Djorevic,hdjorevicp0@amazonaws.com,China Three Gorges University
Kemmer-Stracke,Data Coordiator,Leeland,Esberger,lesbergerp1@barnesandnoble.com,University of Mobile
Walker-Armstrong,Business Systems Development Analyst,Hortense,McGilben,hmcgilbenp2@drupal.org,Pusan National University of Education
Roberts-Crooks,Social Worker,Susette,Portal,sportalp3@boston.com,Khalifa University
Kassulke-Koepp,Senior Sales Associate,Winfred,Lamlin,wlamlinp4@ucsd.edu,University of the City of Manila
"Hauck, Jerde and Dach",Marketing Manager,Anjanette,Chesnay,achesnayp5@tripadvisor.com,Chung Shan Medical and Dental College
Hartmann Group,Media Manager I,Lucie,Brouwer,lbrouwerp6@theguardian.com,Universidad del Valle del Bravo
Daniel LLC,Business Systems Development Analyst,Bernette,Mosedale,bmosedalep7@home.pl,"Washington State University, Tri-Cities"
Hintz and Sons,Geological Engineer,Kissiah,Tuckwell,ktuckwellp8@canalblog.com,Sinnar University
"Leuschke, Langworth and Hartmann",Marketing Assistant,Vanny,Meharry,vmeharryp9@telegraph.co.uk,Universidad de la Fraternidad de Agrupaciones Santo Tomas de Aquino (FASTA)
"Hamill, Turcotte and Wilderman",Tax Accountant,Aubrey,Ingon,aingonpa@ed.gov,Ecole Superieur d'Ingenieurs Leonard de Vinci
Block-Weimann,Quality Engineer,Nicoli,Hogbin,nhogbinpb@tiny.cc,University of Nevada - Las Vegas
Kessler-Kautzer,Senior Sales Associate,Tine,Gras,tgraspc@narod.ru,University of the South
"Friesen, Welch and Bins",Account Coordinator,Fina,Gunning,fgunningpd@biglobe.ne.jp,Agricultural University of Lublin
"Kuvalis, Heller and McCullough",Electrical Engineer,Delia,Mohammed,dmohammedpe@spiegel.de,Dneprodzerzhinsk State Technical University
Schinner-Spinka,VP Marketing,Laurena,Laux,llauxpf@sitemeter.com,Comenius University in Bratislava
Beier Inc,Operator,Elnar,O'Glessane,eoglessanepg@dmoz.org,National Mining University
Jones and Sons,Staff Scientist,Gabriello,Haggish,ghaggishph@fema.gov,Jaypee Institute of Information Technology
Erdman-Greenfelder,Programmer III,Sigfried,Berndt,sberndtpi@domainmarket.com,Haigazian University
Bauch Inc,Pharmacist,Skell,Crowd,scrowdpj@bbc.co.uk,Goldey-Beacom College
Hills-Okuneva,Financial Advisor,Corrianne,Pettet,cpettetpk@indiatimes.com,Shaheed Zulifkar Ali Bhutto Institute of Science and Technology
Wunsch-Watsica,Civil Engineer,Etan,Stockey,estockeypl@linkedin.com,Iowa Wesleyan College
"Mills, Hyatt and Schuster",Sales Representative,Lindsay,Abram,,Union University
Little and Sons,Help Desk Technician,Fernando,Plet,fpletpn@prweb.com,Bohai University
"Murray, Mills and Jakubowski",Statistician III,Shara,Narraway,snarrawaypo@friendfeed.com,Universidade Veiga de Almeida
Stamm-Ratke,Senior Financial Analyst,Christie,Milliere,,Tokai University Educational System
Harvey-Miller,Systems Administrator I,Maximo,Simonaitis,msimonaitispq@google.com, Huaihua University
Treutel Group,Research Nurse,Esmaria,Ditts,edittspr@studiopress.com,Ghulam Ishaq Khan Institute of Science & Technology
Gutmann Inc,VP Sales,Winni,Edds,weddsps@printfriendly.com,Technological Education Institute of Larissa
"Hintz, Romaguera and Parker",Accounting Assistant I,Tommi,Knyvett,tknyvettpt@abc.net.au,Johnson & Wales University
Bogisich-Jast,Help Desk Technician,Debera,Scholling,dschollingpu@twitter.com,Kyushu Sangyo University
Bechtelar-Hansen,Occupational Therapist,Morgan,Milbourne,mmilbournepv@theatlantic.com,Bartlesville Wesleyan College
"O'Reilly, Crona and Bogisich",GIS Technical Architect,Moe,English,menglishpw@uol.com.br,East-Siberian State University
Swaniawski-Schneider,Analyst Programmer,Beltran,Eykel,beykelpx@odnoklassniki.ru,American University of Kuwait 
Fadel-Huel,Speech Pathologist,Janos,Eich,jeichpy@ftc.gov,Bifrost School of Business
Senger LLC,Accountant IV,Judd,Franey,jfraneypz@unesco.org,Estonian University of Life Sciences
Lowe-Lockman,Software Engineer II,Elnore,Godding,egoddingq0@jalbum.net,Yamanashi University
Stokes Group,Chemical Engineer,Paula,Filipponi,pfilipponiq1@mysql.com,Takoradi Polytechnic 
Gibson-Feest,Programmer II,Marillin,Stryde,mstrydeq2@irs.gov,Yerevan State Medical University
Rohan Group,Quality Engineer,Shell,Storer,sstorerq3@surveymonkey.com,College of Mount St. Vincent
Spencer-Collins,Structural Engineer,Leighton,Chatt,lchattq4@is.gd,Fachhochschule Hamburg
"Carroll, Bernhard and Mueller",Software Consultant,Glynis,Plaid,gplaidq5@bing.com,Bowling Green State University
Sipes Inc,Media Manager IV,Dudley,Okenfold,dokenfoldq6@europa.eu,Universitas Mulawarman
Gutkowski LLC,Operator,Sephira,Fluger,sflugerq7@multiply.com,Universidad de Hermosillo
Schmitt-Schaefer,Marketing Assistant,Kaylil,Nielson,knielsonq8@dyndns.org,Irkutsk State University
Rosenbaum-Cremin,Information Systems Manager,Joelynn,Merigot,jmerigotq9@gnu.org,Ambrose Alli University
Kuvalis-Hackett,Senior Cost Accountant,Quinn,Butterfill,qbutterfillqa@narod.ru,"Islamic Azad University, Dehaghan"
"Beahan, Lemke and Dickinson",Speech Pathologist,Joseph,Clemintoni,jclemintoniqb@engadget.com,Athens Laboratory of Business Administration (ALBA)
"Bosco, Witting and Schaden",Speech Pathologist,Crin,Farnorth,cfarnorthqc@instagram.com,East Central University
Tillman-Leffler,Staff Accountant III,Batsheva,Winks,bwinksqd@uol.com.br,Technological University (Myitkyina) 
Rodriguez-Koepp,Actuary,Helga,MacArd,,Ringling College of Art and Design
"Corkery, Kemmer and Mayert",Programmer Analyst IV,Jeannette,Mitrikhin,jmitrikhinqf@booking.com,Health sciences University of Mongolia
"Hagenes, Wilderman and Kutch",Software Engineer III,Gloriane,Gorton,ggortonqg@java.com,Weber State University
Schuppe-Bartoletti,Senior Cost Accountant,Gregg,Agglione,,Russian Academy of Arts
"Sanford, Willms and Lind",Cost Accountant,Ingram,Mendenhall,imendenhallqi@github.com,Western Connecticut State University
Considine-Hackett,Systems Administrator II,Hedy,Dewbury,hdewburyqj@amazon.co.uk,Nanjing Forestry University
Jakubowski-Kertzmann,Analyst Programmer,Zoe,Cawkwell,,Trinity University
"Casper, McClure and Wintheiser",Account Coordinator,Franky,Berresford,fberresfordql@ask.com,Beijing University of Science and Technology
Cartwright and Sons,General Manager,Patti,Risson,prissonqm@google.it,Universidad Nacional de Loja
Auer Group,Financial Analyst,Daniele,Maffini,dmaffiniqn@zdnet.com,Seian University of Art & Design
Larson-Moore,Help Desk Technician,Filippa,Casaroli,fcasaroliqo@opensource.org,Xinghai Conservatory of Music
Crooks Inc,Research Assistant IV,Johanna,Vedstra,jvedstraqp@princeton.edu,Fachhochschule Vorarlberg
"Schaefer, Keeling and Stoltenberg",Environmental Specialist,Darrick,Elderbrant,delderbrantqq@theatlantic.com,Illinois Institute of Technology
Pollich and Sons,Administrative Officer,Celinda,Leeds,cleedsqr@nyu.edu,University of Applied Sciences
"Schinner, McCullough and Marquardt",Assistant Professor,Kaylee,O' Borne,koborneqs@nature.com,University of Livingstonia
Vandervort-Champlin,Budget/Accounting Analyst IV,Vernor,Lucchi,vlucchiqt@gravatar.com,Miyagi University of Education
"Pfannerstill, Heller and Bernhard",Account Representative IV,Iormina,Fee,ifeequ@com.com,Instituto Superior de Relações Internacionais (ISRI) 
