CURRENT COMPANY,JOB TITLE,FIRST NAME,LAST NAME,EMAIL,UNIVERSITY
Bosco Group,Account Coordinator,Dita,Bleas,dbleasdd@google.com.br,University of Liverpool
Toy and Sons,Quality Engineer,Angy,Habershaw,ahabershawde@vistaprint.com,Indiana Institute of Technologyy
Vandervort-Volkman,Technical Writer,Herby,Kleen,hkleendf@etsy.com,Friends University
"O'Hara, Raynor and Durgan",Sales Representative,Rustie,Tallent,rtallentdg@marriott.com,Baker College of Flint
Towne-Kuphal,Operator,Samuele,Ghiroldi,sghiroldidh@alibaba.com,Mukogawa Women's University
"Glover, Nienow and Kuvalis",Chemical Engineer,Melva,Linham,mlinhamdi@ucoz.com,National Tsinghua University
Hayes and Sons,Senior Sales Associate,Beck,Ashwin,bashwindj@scribd.com,Fachhochschule Neubrandenburg
"Flatley, Hartmann and Waters",Technical Writer,Griff,Georgeon,,Woosuk University
Ernser LLC,Cost Accountant,Esta,Easlea,eeasleadl@1und1.de,Nanchang University
Streich LLC,Senior Developer,Aristotle,Coon,acoondm@freewebs.com,Johnson Bible College
"Feeney, Schmitt and Lowe",Paralegal,Marmaduke,Cleave,mcleavedn@cmu.edu,Mountain State University
"Schmeler, Christiansen and Marquardt",Director of Sales,Luther,Washbrook,lwashbrookdo@cmu.edu,"Dubna International University for Nature, Society and Man"
Wilderman LLC,Pharmacist,Andromache,Tonna,atonnadp@sfgate.com,Beirut Arab University
"Parker, Parisian and Emmerich",Design Engineer,Eamon,Ebbage,eebbagedq@bluehost.com,Universidade Católica de Petrópolis
Parker-Osinski,Analyst Programmer,Matelda,Dowker,mdowkerdr@cornell.edu,Universitas Bunda Mulia Jakarta
Haley-Morar,Research Assistant IV,Berni,Baber,bbaberds@a8.net,University of Worcester
Mraz-Turcotte,Occupational Therapist,Doralin,Overell,doverelldt@nymag.com,Technical University of Mombasa
Becker and Sons,Junior Executive,Merilee,Merrifield,mmerrifielddu@accuweather.com,Korea University
Bins LLC,Software Engineer II,Rheta,Minocchi,rminocchidv@nsw.gov.au,Reykjavík University
"Conroy, Lubowitz and Toy",VP Accounting,Kenn,Rigler,kriglerdw@opera.com,Kirikkale University
Parisian-Anderson,Chemical Engineer,Felix,Boot,fbootdx@google.com.au,Universidad Peruana Cayetano Heredia
Flatley LLC,Payment Adjustment Coordinator,Jasen,St. Queintain,jstqueintaindy@auda.org.au,"College of Science, Baghdad University"
Leuschke LLC,Nurse,Lilah,Skellern,lskellerndz@wordpress.com,Chelsea College of Art and Design
"Funk, Fadel and Baumbach",Cost Accountant,Bryant,Poulden,bpouldene0@nba.com,East Texas Baptist University
Swaniawski-MacGyver,Programmer IV,Elyssa,O'Doogan,eodoogane1@topsy.com,Universidad Columbia del Paraguay
Davis-Moen,Pharmacist,Luisa,Peffer,lpeffere2@1und1.de,Grace College
Schoen-Price,VP Marketing,Dorothea,Jevon,djevone3@nature.com,Universidad del Museo Social Argentino
"Kunze, Anderson and Franecki",Automation Specialist III,Elden,Ludovico,eludovicoe4@forbes.com,Université des Sciences et de la Technologie d'Oran
Zemlak-Swift,Account Representative III,Mattias,Altimas,maltimase5@elpais.com,Takasaki City University of Economics
Bashirian-Krajcik,Pharmacist,Marcela,Bettis,mbettise6@theglobeandmail.com,Medical University of Sofia
Franecki-Borer,Junior Executive,Chantal,Augar,caugare7@earthlink.net,Lutheran School Of Theology In Aarhus
Swaniawski-Renner,Assistant Manager,Dyane,Gorriessen,dgorriessene8@exblog.jp,KROK Economics and Law University
Lesch-DuBuque,Social Worker,Rancell,Pigott,rpigotte9@facebook.com,Universidade Federal da Paraíba
Sauer LLC,Project Manager,Ali,Corns,acornsea@cbc.ca,Regent International University
"Volkman, Harris and Donnelly",Occupational Therapist,Leesa,Hundley,lhundleyeb@cmu.edu,University of the Gambia
Champlin LLC,Marketing Manager,Timmie,Dondon,tdondonec@wikia.com,Université Mentouri Constantine
Lowe Inc,Media Manager I,Sheena,Althrope,salthropeed@cisco.com,University of Bristol
"Lubowitz, Beatty and Rau",Graphic Designer,Hernando,Woffenden,hwoffendenee@virginia.edu,Universidade Estadual do Maranhão
O'Reilly LLC,Director of Sales,Editha,McGauhy,emcgauhyef@state.gov,Management and Science University
Pagac and Sons,Accounting Assistant II,Hymie,Edwicke,hedwickeeg@auda.org.au,"Institut d'Agriculture, de Technologie et d'Education de Kibungo"
Reichert Inc,Nuclear Power Engineer,Fulvia,Emptage,femptageeh@comsenz.com,Sichuan Agricultural University
"Bergstrom, Daniel and Hickle",Accountant III,Udale,Wilks,uwilksei@mtv.com,Dalanj University
"Hauck, Lubowitz and Mann",Web Developer III,Herc,Kenward,hkenwardej@shinystat.com,Abia State University
Kozey and Sons,Engineer IV,Lindsay,Denniston,,Türkisch-Deutsche Universität
Reilly-Schumm,Recruiter,Ruggiero,Brigstock,rbrigstockel@twitpic.com,St Theresa's Medical University
Kessler and Sons,Payment Adjustment Coordinator,Rudyard,Duligall,rduligallem@github.io,University of Hong Kong
"Mitchell, Kuhic and Leannon",Design Engineer,Sile,Friar,sfriaren@nifty.com,Kuban State University of Agriculture
Mann Inc,Systems Administrator III,Care,Fears,cfearseo@webeden.co.uk,Sojourner-Douglass College
"Nikolaus, Hamill and O'Kon",Geologist I,Arturo,Naismith,anaismithep@alexa.com,Iwate Medical University
"Kuvalis, Lockman and Jaskolski",Marketing Manager,Sonnie,MacCartney,smaccartneyeq@vimeo.com,Xinghai Conservatory of Music
Hyatt-Hickle,Statistician I,Susana,Brimble,sbrimbleer@sciencedirect.com,National Taiwan Ocean University
Farrell Inc,Research Nurse,Yettie,Pirelli,ypirellies@netvibes.com,Universidad Autónoma de Santa Ana
Roberts-McGlynn,Accounting Assistant IV,Troy,Brusin,tbrusinet@prnewswire.com,Vikram University
Gislason-Hintz,Graphic Designer,Aindrea,Likly,aliklyeu@slideshare.net,King Fahad University of Petroleum and Minerals
Wilderman Group,Human Resources Manager,Cassy,Lissett,clissettev@archive.org,"Hochschule Wismar, Fachhochschule für Technik, Wirtschaft und Gestaltung"
Hodkiewicz and Sons,Cost Accountant,Gabey,Spiller,gspillerew@woothemes.com,University of Canterbury
"Thiel, Blanda and Murazik",Recruiting Manager,Bert,Sibbit,bsibbitex@hatena.ne.jp,Central State University
"Botsford, Schamberger and Strosin",Human Resources Assistant IV,Tedd,Devorill,tdevorilley@amazon.co.uk,State University of New York College at Cortland
Bashirian-Kuphal,Nurse,Dalia,Jirzik,djirzikez@goo.gl,Tianjin University of Commerce
Willms LLC,Quality Engineer,Alic,Corsor,acorsorf0@amazon.co.jp,University of Veterinary and Pharmaceutical Science
Jerde Group,Administrative Assistant IV,David,Carbonell,dcarbonellf1@google.cn,Hokkaido Information University
Rosenbaum-Lind,Actuary,Jewell,Croydon,jcroydonf2@dedecms.com,Universidade Estadual Paulista
Kling Inc,Cost Accountant,Ainslie,Donaher,adonaherf3@deliciousdays.com,Guangzhou Normal University
Kshlerin LLC,Associate Professor,Sammy,Fremantle,sfremantlef4@wikipedia.org,University of Madras
Braun LLC,Web Designer IV,Rosemarie,Cunniam,rcunniamf5@w3.org,Skadron College
"Funk, Windler and Ryan",Project Manager,Barbey,Barenskie,bbarenskief6@hostgator.com,Ecole Superieur d'Ingenieurs Leonard de Vinci
Skiles and Sons,Operator,Georgi,Stearn,gstearnf7@pbs.org,Sichuan Agricultural University
"Buckridge, Runolfsdottir and Price",Teacher,Zacharias,MacClure,zmaccluref8@cpanel.net,Western Mindanao State University
Shanahan-Krajcik,Actuary,Marcile,Pountney,mpountneyf9@smh.com.au,Yonsei University
"Fisher, Bayer and Dietrich",Financial Analyst,Cyndy,Le-Good,clegoodfa@google.fr,Universidad Nacional Daniel Alcides Carrion
Kirlin-Treutel,Web Designer II,Tobe,Cloughton,tcloughtonfb@imgur.com,Université de Reims Champagne-Ardenne
Conroy Group,Health Coach I,Hilliary,Philott,hphilottfc@digg.com,Yamanashi Medical University
Swaniawski LLC,Media Manager I,Katinka,Gogin,kgoginfd@eepurl.com,Universidade do Amazonas
"Mann, Spinka and Gleichner",Staff Accountant II,Ulrike,Capelow,ucapelowfe@parallels.com,Mount Marty College
Olson-Corkery,Clinical Specialist,Gardy,Pyer,,Tomball College
"Hauck, Conn and Ullrich",Nurse Practicioner,Kirk,Foro,kforofg@huffingtonpost.com,Universidad Autónoma de Campeche
Armstrong-Labadie,Dental Hygienist,Cassondra,Sewter,csewterfh@toplist.cz,Port Said University
Wolf and Sons,Food Chemist,Alex,Boorne,aboornefi@studiopress.com,University of Northern Bahr El-Ghazal
"Mann, Kihn and Swift",Account Coordinator,Rawley,Laurence,rlaurencefj@uiuc.edu,Universitas Padjadjaran
Parisian Group,Financial Advisor,Smitty,Gillott,sgillottfk@miitbeian.gov.cn,Balochistan University of Engineering and Technology Khuzdar
"Schiller, Lubowitz and Zieme",Research Nurse,Ron,Ivankovic,rivankovicfl@myspace.com,Universidad Catolica del Norte
Gutkowski and Sons,Electrical Engineer,Wain,Cooch,wcoochfm@intel.com,Hitotsubashi University
Feil-Pagac,Geological Engineer,Lethia,Hentze,lhentzefn@indiatimes.com,Tokyo Woman's Christian University
Huel Group,Human Resources Manager,Mallissa,Wabb,mwabbfo@bloglines.com,Khabarovsk State Academy of Economics and Law
Hudson Group,Associate Professor,Tudor,Howick,thowickfp@ow.ly,Cogswell Polytechnical College
"Welch, Kirlin and O'Reilly",Community Outreach Specialist,Errick,Huitt,ehuittfq@microsoft.com,Tilka Manjhi Bhagalpur University
Little-Torp,Data Coordiator,Midge,Guitonneau,mguitonneaufr@google.co.uk,University of Hull
"Funk, Nicolas and Simonis",Office Assistant I,Livvyy,Jahndel,ljahndelfs@mapy.cz,Purdue University Calumet
Ferry and Sons,Assistant Manager,Rosanne,Bertolaccini,,Hochschule Coburg
Huels and Sons,Research Assistant III,Charyl,Ebi,cebifu@ezinearticles.com,Worcester State College
Oberbrunner and Sons,Recruiter,Dagmar,Matous,dmatousfv@discovery.com,University of Mississippi
Smith Inc,Food Chemist,West,Harm,wharmfw@liveinternet.ru,Hochschule für Politik (HFP)
Wiza and Sons,Cost Accountant,Claudine,Hubber,chubberfx@chicagotribune.com,Texas College of Osteopathic Medicine
Hand-Gutkowski,Speech Pathologist,Brody,Copcote,bcopcotefy@icio.us,Université de Technologie de Compiègne
"Cummerata, Mayer and D'Amore",Teacher,Henriette,Bolliver,hbolliverfz@canalblog.com,Kwangwoon University
Gaylord-Kemmer,Software Consultant,Graeme,Mattioli,gmattiolig0@spiegel.de,Universidad de Carabobo
Doyle-Waelchi,Senior Developer,Ines,Wetter,,Philadelphia College of Osteopathic Medicine
Kemmer Group,Help Desk Operator,Else,Glennie,eglennieg2@etsy.com,Institut d'Etudes Politiques de Bordeaux
"Padberg, Wisoky and Mills",VP Marketing,Melinde,Canty,mcantyg3@tamu.edu,Central Institute of English and Foreign Languages
Considine-Mayer,Nurse,Fayina,Ramos,framosg4@mapy.cz,Josai University
"MacGyver, Buckridge and Hessel",Quality Engineer,Eddi,Anand,eanandg5@economist.com,Faculté Polytechnique de Mons
Bins-Hyatt,Chemical Engineer,Lenee,Druery,ldrueryg6@telegraph.co.uk,Kangwon National University
"Rodriguez, Adams and Ritchie",Engineer I,Ingeborg,Imloch,iimlochg7@wired.com,National Taipei University
Hamill-Hudson,Geologist IV,Fianna,Plester,fplesterg8@cnet.com,Stavropol State Technical University
"Abernathy, Daugherty and Lind",Human Resources Manager,Carilyn,Freeborne,cfreeborneg9@symantec.com,Kendall College of Art and Design
Graham Group,Chief Design Engineer,Rosalie,Brosio,rbrosioga@yolasite.com,"Universidad Católica Boliviana, Cochabamba"
Romaguera Group,Project Manager,Saloma,Wardale,swardalegb@bigcartel.com,Shaheed Beheshti University of Medical Sciences
Hudson-Schroeder,Payment Adjustment Coordinator,Tracey,Kilminster,tkilminstergc@purevolume.com,"Télé-université, Université du Québec"
Renner-Russel,General Manager,Verina,Iannetti,viannettigd@t-online.de,Azerbaijan Technical University
"Connelly, D'Amore and Krajcik",Food Chemist,Terri,Bisco,tbiscoge@feedburner.com,Edgewood College
Emmerich Group,Pharmacist,Elaina,Fitzharris,efitzharrisgf@miitbeian.gov.cn,University of Botswana
Goldner-Cassin,Engineer III,Davita,Keane,dkeanegg@ning.com,Universidad México Americana del Norte
"Boyer, Collier and Hermiston",Legal Assistant,Rutter,Cheng,rchenggh@netlog.com,Bethany College California
Cremin-Mitchell,Administrative Assistant III,Gale,Santhouse,gsanthousegi@ocn.ne.jp,University of Eldoret
Towne Group,Human Resources Assistant IV,Morna,Czadla,mczadlagj@wordpress.com,Chiba Institute of Technology
Veum and Sons,Developer III,Catlaina,Androletti,candrolettigk@lulu.com,John Marshall Law School
Pollich-Powlowski,Office Assistant I,Maribelle,Barles,mbarlesgl@china.com.cn,Fachhochschule Schmalkalden
West LLC,Office Assistant I,Beverie,Potkin,bpotkingm@dropbox.com,Mälardalen University
"Cormier, Steuber and Hodkiewicz",Professor,Sada,Reinbach,sreinbachgn@networkadvertising.org,Universidad Obrera de Mexico
Stokes Inc,Senior Editor,Homerus,Roelofs,hroelofsgo@cloudflare.com,Bayerische Julius-Maximilians-Universität Würzburg
"Jacobs, Senger and Osinski",Account Executive,Cecilio,Ashment,cashmentgp@blogs.com,Gordon Conwell Theological Seminary
Pollich Group,Speech Pathologist,Benny,Beedle,bbeedlegq@fc2.com,"Music Academy ""Felix Nowowiejski"" in Bydgoszcz"
"Hermiston, Morar and West",Research Associate,Gianna,Tibald,gtibaldgr@cnet.com,Ecole Normale Supérieure de Lyon
Kiehn-Bashirian,Occupational Therapist,Nollie,Ziemen,nziemengs@hibu.com,Damghan University of Basic Sciences
Howell LLC,Senior Developer,Amelia,Caldero,acalderogt@list-manage.com,Fachhochschule für die Wirtschaft
Trantow-Kiehn,Developer IV,Katrinka,Haylett,khaylettgu@creativecommons.org,Northwestern Oklahoma State University
Cummerata-Rolfson,Nurse Practicioner,Philippe,Gonzalez,pgonzalezgv@narod.ru,Anna University
Wilkinson and Sons,Financial Advisor,Roseann,Arundell,rarundellgw@goodreads.com,European College of Liberal Arts
Hayes Group,Pharmacist,Lula,Anmore,lanmoregx@pcworld.com,William Tyndale College
"McClure, Kunze and Braun",Senior Sales Associate,Brendis,Moffat,bmoffatgy@php.net,Universidad Mexicana
Botsford Group,Legal Assistant,Hieronymus,Cartin,hcartingz@google.es,American Graduate School in Paris
"Macejkovic, Torphy and White",Environmental Specialist,Amara,Renouf,,Ural State Academy of Architecture and Arts
Leuschke LLC,VP Accounting,Llywellyn,Deshorts,ldeshortsh1@oakley.com,Mendel University of Agriculture and Forestry
Hirthe Inc,Developer III,Cyrillus,Ilsley,cilsleyh2@mozilla.org,Baltimore International College
Jacobi and Sons,Senior Financial Analyst,Guthry,Siddons,gsiddonsh3@berkeley.edu,Ho Chi Minh City Open University
Ledner-Gaylord,Quality Control Specialist,Shaine,Bruckstein,sbrucksteinh4@narod.ru,Universidad Estatal de Bolívar
Huel Group,Research Associate,Lucienne,Lamond,llamondh5@state.gov,St. Joseph Group of Institutes
"O'Connell, Mayert and Lehner",Account Representative III,Theodosia,Harmston,tharmstonh6@cornell.edu,Faculdades Integradas Toledo
Shields Group,Project Manager,Rudy,Terbeek,rterbeekh7@theglobeandmail.com,Libyan International Medical University (LIMU)
Schmitt and Sons,Design Engineer,Coop,Holton,choltonh8@twitpic.com,University of Buckingham
Paucek-Sanford,GIS Technical Architect,Yvor,Spennock,yspennockh9@posterous.com,Fachhochschule Pur
Farrell LLC,Office Assistant III,Evin,Ianniello,eiannielloha@answers.com,Bundelkhand University
"Kuphal, Mosciski and Cruickshank",Data Coordiator,Tiff,Weld,tweldhb@icq.com,Kawasaki University of Medical Care
Reilly-Hartmann,Administrative Assistant IV,Sylvester,Toler,stolerhc@wiley.com,Stamford International University
Nikolaus Group,Sales Associate,Claudetta,Lamps,clampshd@ed.gov,Blackburn College
Haag Inc,Analog Circuit Design manager,Felizio,Codman,fcodmanhe@ted.com,Monmouth University
"Tromp, Labadie and Willms",Chemical Engineer,Justus,O'Regan,joreganhf@gravatar.com,Gandhigram Rural Institute
Erdman Inc,Analyst Programmer,Caryn,Leyson,,College of the Ozarks
"Rolfson, Ruecker and Becker",Staff Scientist,Nobie,Houseley,nhouseleyhh@symantec.com,International University of Kyrgyzstan
Larkin-Beier,Software Engineer II,Emogene,Tennison,etennisonhi@dailymotion.com,Grinnell College
Medhurst-Jast,Automation Specialist III,Bren,Thatcher,bthatcherhj@wired.com,Bamiyan University
"Sanford, Abshire and Maggio",Research Associate,Abby,O'Heffernan,aoheffernanhk@diigo.com,Muhimbili University of Health and Allied Sciences (MUHAS)
"Schimmel, Thompson and Abbott",Account Executive,Jaquelyn,O' Mahony,jomahonyhl@rambler.ru,State University of New York College at Oneonta
O'Kon-Mann,VP Marketing,Cristen,Fibbings,cfibbingshm@geocities.com,Mount Kenya University
"Barton, Nolan and Wolff",Actuary,Matthew,Guerriero,mguerrierohn@sohu.com,Fachhochschule Burgenland
"Russel, Glover and DuBuque",Account Coordinator,Krishnah,Piaggia,kpiaggiaho@shop-pro.jp,St. Mary's University
Beier-Volkman,Chemical Engineer,Lyssa,Martt,lmartthp@cam.ac.uk,Institut Teknologi Adhi Tama Surabaya
Marvin-Hamill,Legal Assistant,Ham,Stanes,,University of Constanta
"Lehner, Graham and Corwin",Director of Sales,Consuela,Minerdo,cminerdohr@goo.gl,The Federal Polytechnic Offa
"Zboncak, Harvey and Friesen",Systems Administrator IV,Mariya,Tollit,mtolliths@is.gd,Institut Supérieure d'Electronique de Paris
"Keebler, Batz and O'Hara",GIS Technical Architect,Aland,Rein,areinht@dedecms.com,Universidad Tecnológica Nacional
McKenzie-Grady,Structural Engineer,Demetri,Loukes,dloukeshu@ted.com,Dickinson State University
"Harris, Mills and Mueller",Account Executive,Kimberly,Leadston,kleadstonhv@examiner.com,Yalova University
King-Moen,Chemical Engineer,Adella,Riddington,ariddingtonhw@icio.us,Jatiya Kabi Kazi Nazrul Islam University
Fritsch LLC,Environmental Tech,Arlana,Spaldin,aspaldinhx@nba.com,Universidad Autónoma de Nayarit
"Becker, Armstrong and Leuschke",Accountant II,Edan,Ropcke,eropckehy@google.es,Washington College
"Murray, Yost and Maggio",Legal Assistant,Jase,Francescotti,jfrancescottihz@ycombinator.com,Kyushu Sangyo University
"Leffler, Fisher and Olson",Human Resources Manager,Gray,Busain,,Graceland College
Nitzsche-Greenholt,Compensation Analyst,Yoshi,Clubley,yclubleyi1@dion.ne.jp,Richard Stockton College of New Jersey
Hansen-O'Conner,Analyst Programmer,Gussy,Shortland,gshortlandi2@google.com,Universidade Federal do Rio de Janeiro
Gleason-White,Community Outreach Specialist,Devonna,Durand,ddurandi3@newsvine.com,"Taylor University, Fort Wayne Campus"
"Brakus, Funk and Gorczany",Librarian,Isidro,Davioud,idavioudi4@4shared.com,Université de Jendouba
Waters LLC,Environmental Tech,Kevon,Philo,kphiloi5@soup.io,University of Calcutta
"Goyette, Satterfield and Kris",Computer Systems Analyst III,Jephthah,Twort,jtworti6@weather.com,National University of Theater and Film Arts
"Osinski, Barton and Weimann",Senior Cost Accountant,Jory,Labone,jlabonei7@csmonitor.com,"Webster University, Thailand"
"Hickle, Schmidt and Bartoletti",Senior Financial Analyst,Vallie,Quan,vquani8@gnu.org,Sanjay Gandhi Postgraduate lnstitute of Medical Sciences
"Mueller, Schaden and Runolfsson",Junior Executive,Dorisa,Barriball,dbarriballi9@craigslist.org,College of Busniess Admnistration
Blanda LLC,Chemical Engineer,Demetria,Klewi,,University of Gezira
Spencer-Skiles,Geologist III,Kiele,Galea,kgaleaib@deviantart.com,Siberian State Transport University
"Kerluke, Grimes and Ward",Software Test Engineer III,Derek,Sotworth,dsotworthic@prweb.com,Sherman College of Straight Chiropractic
Ullrich-Buckridge,Structural Engineer,Nero,Bratt,nbrattid@mozilla.com,University of Akron
Herzog-Mohr,Financial Analyst,Karia,Tumbridge,,University of Windsor
"Wisozk, O'Kon and Boyer",Nurse Practicioner,Valida,Armstead,varmsteadif@huffingtonpost.com,University College of Saint-Boniface
Gottlieb Group,Geological Engineer,Larry,Lindemann,llindemannig@chronoengine.com,Musashino Academy of Music
"Durgan, Schimmel and Goldner",Assistant Media Planner,Federico,Garaghan,fgaraghanih@tinyurl.com,"Moscow State University of Economics, Statistics and Informatics"
"Dickens, Dare and Harber",Software Engineer II,Dorelle,Lyptratt,dlyptrattii@ft.com,"University of Maine, Machias"
Hessel-Abbott,Assistant Manager,Lianna,Pleavin,lpleavinij@usda.gov,Otsuma Women's University
Schulist-Collier,Geological Engineer,Francyne,Clulee,fcluleeik@cnet.com,Universidad Autonoma  de Durango
"Kuphal, Treutel and Raynor",Librarian,Manon,Grigorini,mgrigoriniil@economist.com,Razi University
Thompson and Sons,Nuclear Power Engineer,Gabriele,Housby,ghousbyim@buzzfeed.com,Campus Bio-Medico University of Rome
"Rath, Kulas and Shanahan",Assistant Manager,Franchot,Demougeot,fdemougeotin@weibo.com,Universität Kassel
Nitzsche Group,Recruiter,Sallie,Dunsford,sdunsfordio@ft.com,Blue Nile University
Hessel-Wintheiser,Mechanical Systems Engineer,Cassy,Valenti,,Kirksville College of Osteopathic Medicine
"Dickinson, Koss and Adams",Chief Design Engineer,Rebecca,Ravenshaw,rravenshawiq@cornell.edu,Mohan Lal Sukhadia University
"Johnston, Harvey and Denesik",Civil Engineer,Tobit,Waldron,twaldronir@washington.edu,Fachhochschule für die Wirtschaft
O'Kon-Kunde,Environmental Specialist,Billi,Doddemeade,bdoddemeadeis@tamu.edu,Universidad Nacional de Lanus
Rogahn-Zemlak,Chief Design Engineer,Rollin,Saggs,rsaggsit@t-online.de,Universidad Nacional de Lanus
"Ondricka, Dickinson and McGlynn",Physical Therapy Assistant,Maureene,Haking,mhakingiu@usnews.com,"Federal University of Technology, Akure"
"Willms, Langworth and Krajcik",Recruiter,Ruthie,Christensen,rchristenseniv@jiathis.com,Universidad Simón Bolivar
"Baumbach, Hickle and Bogisich",Marketing Manager,Anthe,Archbell,aarchbelliw@hostgator.com,Konkan Agricultural University
"Koch, Graham and Emard",Account Coordinator,Boy,Gorey,bgoreyix@irs.gov,Nanjing Medical University
Russel Inc,Assistant Media Planner,Hubie,Weall,hwealliy@goo.gl,Pokhara University
"Satterfield, Kris and Zulauf",Speech Pathologist,Katine,Lease,kleaseiz@shinystat.com,Mid-Continent Baptist Bible College
Cormier Group,Sales Representative,Maurene,Terese,mteresej0@nyu.edu,American University College of Technology
Ratke-Zulauf,Compensation Analyst,Sibylle,Kirvell,skirvellj1@ft.com,Southwestern Baptist Theological Seminary
"Wiza, Terry and Bednar",Structural Analysis Engineer,Si,Plunkett,splunkettj2@posterous.com,Central Bible College
"Dooley, Smitham and Grady",Budget/Accounting Analyst I,Minne,Martinson,mmartinsonj3@narod.ru,Siam Technology College
Johnson-Morar,Librarian,Aldin,Sturgess,asturgessj4@unicef.org,University of Sindh
Howe-Treutel,Physical Therapy Assistant,Mala,Chesswas,mchesswasj5@i2i.jp,Universidade Federal de Juiz de Fora
"Lueilwitz, Kuhlman and Wiegand",Sales Representative,Ileana,Bartholomaus,ibartholomausj6@simplemachines.org,Ecole Européen des Affaires
"Maggio, Ortiz and Waters",Sales Representative,Enriqueta,Judkin,ejudkinj7@e-recht24.de,Texila American University
"Schuster, Mosciski and Hoeger",Data Coordiator,Georgena,Oxlee,goxleej8@a8.net,Mahatma Gandhi University Meghalaya 
Goyette and Sons,Assistant Manager,Margret,Ysson,myssonj9@e-recht24.de,Halic University
"Douglas, Pollich and Schinner",Senior Quality Engineer,Heindrick,Pedrozzi,hpedrozzija@ask.com,Kwangwoon University
"Tillman, Bailey and Ebert",Budget/Accounting Analyst II,Theo,Bletsor,tbletsorjb@cnet.com,"Islamic Azad University, Majlesi"
Stanton-Collins,Software Engineer IV,Maddie,Fishpool,mfishpooljc@ifeng.com,Niigata University of International and Information Studies
O'Conner LLC,Research Assistant IV,Vallie,Porch,vporchjd@globo.com,Guru Jambeshwar University
"Hand, Kuhic and Blanda",Staff Accountant IV,Grant,Epperson,geppersonje@ca.gov,"University of Agricultural Sciences, Dharwad"
"Osinski, Price and Hodkiewicz",Community Outreach Specialist,Maureene,Kinloch,mkinlochjf@weibo.com,Slovak University of Technology in Bratislava
Homenick LLC,Operator,Ker,Pitkin,kpitkinjg@berkeley.edu,Bellevue University
Russel Inc,Assistant Professor,Sampson,Simenel,ssimeneljh@biglobe.ne.jp,Evangelische Fachhochschule Nürnberg
"Cummings, Casper and Senger",Sales Associate,Elizabeth,Patis,epatisji@unc.edu,Universität Osnabrück
"Considine, Hane and Boyle",Electrical Engineer,Rabbi,Ovington,rovingtonjj@cnbc.com,Free University (Virginia Theological University)
Powlowski-McLaughlin,Social Worker,Heidie,McCaffrey,hmccaffreyjk@fastcompany.com,University of York
"Rau, Pfeffer and Borer",Tax Accountant,Connie,Seldon,cseldonjl@noaa.gov,University of Cape Town
Herman-Block,Professor,Bunni,Plumridge,bplumridgejm@wp.com,Ecole Supérieure d'Ingénieurs en Génie Electrique
"Grimes, Stokes and Berge",Structural Engineer,Keir,Le Estut,kleestutjn@pagesperso-orange.fr,Tripura University
"Hane, Bahringer and McLaughlin",Computer Systems Analyst II,Anestassia,Methley,amethleyjo@1und1.de,Alderson Broaddus College
"Zulauf, Fritsch and Rohan",Food Chemist,My,D'Elias,mdeliasjp@narod.ru,Universidad Politécnica de Cartagena
Block Inc,Professor,Pepi,McMeekin,pmcmeekinjq@tamu.edu,"University of Northern Virginia, Prague Campus"
Johnson-Purdy,Chemical Engineer,Gram,Duffyn,gduffynjr@vkontakte.ru,Fachhochschulstudiengänge Steyr
Braun-Murray,Compensation Analyst,Sapphire,Sirette,ssirettejs@pcworld.com,Universität Paderborn
"Walker, Beatty and Greenholt",Chief Design Engineer,Norine,Lunam,nlunamjt@arstechnica.com,"Merz Akademie, Hochschule für Gestaltung Stuttgart"
"Orn, Collier and Dach",Senior Cost Accountant,Guthrey,Speight,gspeightju@skype.com,University of Texas Health Center at Tyler
"VonRueden, Borer and Grady",Teacher,Kym,Bullus,kbullusjv@thetimes.co.uk,Glendale University College of Law
"Grant, Nikolaus and Kutch",Assistant Media Planner,Consuelo,Gueste,cguestejw@nydailynews.com,Sichuan International Studies University
Labadie-Williamson,Design Engineer,Felipe,Haensel,fhaenseljx@dmoz.org,Copenhagen Business School
"Shields, Trantow and Balistreri",Senior Editor,Bertina,Grantham,bgranthamjy@nyu.edu,Université Gamal Abdel Nasser de Conakry
Herman Inc,Physical Therapy Assistant,Fred,Danelut,fdanelutjz@prlog.org,University of Texas at Tyler
"Champlin, Bradtke and Terry",Developer IV,Kirsteni,Di Giorgio,kdigiorgiok0@dell.com,University of Mustansiriyah
"Hodkiewicz, White and Champlin",Senior Quality Engineer,Estelle,Kittel,,Tashkent Automobile and Roads Institute
Leuschke and Sons,Legal Assistant,Garland,Lenham,glenhamk2@irs.gov,Mongolian National University
